title,page_content,criteria,Địa điểm:,Thời gian:,BTC:,Hạn nộp MC:
Podcast tư vấn kỹ năng quản lý tài chính cá nhân: Thiết lập mục tiêu,"Trong Tuần định hướng SV K69, các bạn đã được nghe diễn giả dến từ 2Target chia sẻ về các kiến thức quản lý tài chính cá nhân, là kiến thức vô cùng hữu ích. Chúng ta có thể điểm qua một số chia sẻ quan trọng từ chuyên gia giúp bạn quản lý tài chính thông minh, hiệu quả:
1️⃣ Bản đồ chinh phục tự do tài chính: Hành trình này dựa trên 3 cột trụ: quản lý tiền thông thái, bảo vệ tiền và nâng cao năng lực kiếm tiền. Khi bạn càng kiểm soát tốt 3 cột trụ này thì sẽ càng nhanh đến đích tự do tài chính!
2️⃣ Lập kế hoạch tài chính: Phân chia thu nhập hợp lý, quản lý chi tiêu và tiết kiệm hiệu quả - điều này sẽ tạo nền tảng vững chắc với những tình huống khẩn cấp của bạn
3️⃣ Phương pháp quản lý chi tiêu 50-30-20: Hãy dành 50% thu nhập cho các nhu cầu thiết yếu, 30% cho sở thích, giải trí và 20% cho tiết kiệm, đầu tư. Phương pháp này sẽ giúp bạn kiểm soát tiền bạc hiệu quả mà vẫn có thể tận hưởng cuộc sống.
4️⃣ Nguyên tắc của người giàu ""Tiết kiệm trước, chi tiêu sau"": Đây là bí quyết giúp bạn xây dựng nền tảng tài chính ổn định và đạt được những mục tiêu lâu dài.
5️⃣ Nhận diện cạm bẫy tài chính: Cẩn trọng trước những vụ lừa đảo và luôn bảo mật thông tin cá nhân. Đừng bao giờ chuyển tiền khi chưa hoàn toàn tin tưởng!
Để các bạn nắm được những kiến thức kỹ hơn, Ban CTSV trao đổi với 2Target để tổ chức một số buổi tư vấn online dành cho các bạn quan tâm, trong khoảng thời gian cuối tháng 9 đến nửa đầu tháng 10.24. 
Buổi 1: 20h00 ngày 25/9/2024 link MS team Ban tổ chức gửi cho các bạn qua email các bạn đăng ký.
📌 Chuyên gia: Tạ Thanh Tùng
 📌 Nội dung chính của buổi số #01 là: Thiết lập mục tiêu
Trong buổi tư vấn trực tuyến này, bạn sẽ:
⭐ Hiểu rõ tầm quan trọng của việc thiết lập mục tiêu tài chính
⭐ Biết cách và thực hành thiết lập mục tiêu tài chính theo nguyên tắc SMART
 ⭐ Nhận được câu trả lời cho câu hỏi: Làm sao để chinh phục mục tiêu tài chính của bạn?
 Ngoài ra, chuyên gia sẽ trực tiếp giải đáp những thắc mắc của SV xoay quanh vấn đề tài chính cá nhân.
👉 Cơ hội tuyệt vời để nâng cao kiến thức tài chính và trang bị những kỹ năng cần thiết cho tương lai đang ở ngay trước mắt! 
Đừng bỏ lỡ, hãy đăng ký ngay và cùng chia sẻ với bạn bè để tất cả chúng ta đều có thể tự tin quản lý tài chính của mình và hướng tới một cuộc sống thành công, vững vàng hơn!
Để tham gia chương trình các bạn đăng ký tham gia hoạt động, Tổ triển khai đề án hỗ trợ sinh viên năm thứ nhất sẽ gửi mail thông tin cho các bạn.","1, Tham gia hội thảo tăng cường kỹ năng mềm, phương pháp học tập, ý thức học tập, làm việc
2, Có hành động tích cực trên không gian mạng (hoạt động online) phù hợp với chủ trương của Nhà trường, Nhà nước được tập thể ghi nhận",MS Teams,00:00 25/09/2024 đến 00:00 25/09/2024,Tổ triển khai ĐA hỗ trợ SV năm nhất,00:00 25/09/2024
Chương trình trải nghiệm về ứng dụng AI trong học tập dành cho sinh viên,"Thời gian: 8h00 - 18h30 ngày 19/09/2024
Địa điểm: Hội trường C2 - Đại học Bách khoa Hà Nội
🔥Các hoạt động bao gồm:
☑️Workshop công nghệ
☑️Gian hàng trải nghiệm sản phẩm, vệ sinh máy miễn phí, check-in nhận quà, khuyến mãi đặc biệt cho sinh viên
☑️Ca sĩ khách mời và các CLB âm nhạc của HUST
🔥Timeline sự kiện:
☑️Sáng: Workshop công nghệ, hoạt động gian hàng
☑️Chiều: Hoạt động gian hàng, âm nhạc
🔥Cơ hội nhận những phần quà hấp dẫn:
☑️Quà tặng check-in: túi tote, nón, sticker
☑️Quà tặng từ các hoạt động minigame, vòng quay may mắn, giải đấu TFT: vali cao cấp, balo, lót chuột, tai nghe, …
🔥Gặp gỡ dàn khách mời siêu uy tín:
☑️Reviewer Tuấn Ngọc Đây
☑️MOD Vi Mạnh Dũng
☑️Streamer Ghiền
☑️Ca sĩ Chi Xê
🎤🎼Đặc biệt có sự tham gia của gương mặt nghệ sĩ vô cùng sáng giá: CA SĨ CHI XÊ - một tài năng trẻ đầy triển vọng của làng nhạc Việt!💥💥💥","1, Tham gia hội thảo tăng cường kỹ năng mềm, phương pháp học tập, ý thức học tập, làm việc",Hội trường C2,08:00 19/09/2024 đến 18:30 19/09/2024,Ban CTSV,18:30 19/09/2024
Xây dựng kế hoạch học tập và chi tiêu cho học kỳ 2024.1,"Việc xây dựng kế hoạch học tập và chi tiêu hiệu quả là rất quan trọng để định hướng quá trình học tập, hoạt động và quản lí chi tiêu của bạn một cách hiệu quả. Điều này giúp bạn đạt được các mục tiêu mong muốn. Ngoài việc tham gia các lớp học, bạn có thể tham gia các hoạt động khác như làm thêm hoặc công tác xã hội. Do đó, quản lý thời gian và chi tiêu là một thách thức lớn. Chúng tôi khuyến khích sinh viên chủ động xây dựng kế hoạch học tập và chi tiêu phù hợp với cá nhân mình.
Ban CTSV kết hợp với CLB o365 - HUST đã xây dựng một file Excel cho phép bạn phác thảo có tổ chức các hoạt động theo thời gian khoản chi tiêu hay thu nhập. Sau khi hoàn thành bản phác thảo thì bạn sẽ biết cách sử dụng thời gian, sức khỏe và tiền bạc một cách hiệu quả để đảm bảo rằng bạn luôn đủ nguồn lực để tham gia các hoạt động chính khóa và ngoại khóa. Và hơn thế nữa xây dựng kế hoạch sẽ giúp bạn tiến gần hơn đến các mục tiêu học tập và làm việc.
Ở đây chúng tôi có bao gồm 2 công cụ giúp bạn có thể dễ dàng sử dụng và lập ra một kế hoạch học tập và chi tiêu hiệu quả nhất. Bạn có thể tải và xem hướng dẫn sử dụng của một trong hai công cụ tại đây: file xây dựng kế hoạch hoạt động và chi tiêu tại đây.
Để xây dựng kế hoạch này, các bạn:
Vận dụng các kiến thức đã được trang bị trong tuần SHCD;
Tham khảo tài liệu Sổ tay sinh viên 2024
Hỏi các thầy cô, ảnh chị và phụ huynh để hoàn thiện kế hoạch này tốt nhất.
Nếu có khó khăn, hoặc muốn đề xuất phát triển file excel bạn có thể liên hệ với CLB o365 - HUST.
Để được cấp MC cho hoạt động, bạn nộp kế hoạch bạn vào đây: https://forms.office.com/r/3N3D2ZnxE3","1, Có kế hoạch học tập và rèn luyện phù hợp được thầy cô ghi nhận",o365,00:00 16/09/2024 đến 00:00 31/10/2024,Ban CTSV,00:00 31/10/2024
[2024-1] Khảo sát về việc tham gia sinh hoạt Câu lạc bộ sinh viên,"Hoạt động khảo sát được Ban Công tác Sinh viên làm Chủ trì dưới sự chỉ đạo của Ban Giám đốc. Hoạt động có mục tiêu và ý nghĩa:
Định hướng việc thành lập và phát triển CLB/Tổ/Đội/Nhóm sinh viên, một số lưu ý khi tham gia các CLB/Tổ/Đội/Nhóm do sinh viên thành lập. Giúp Ban Lãnh đạo Đại học làm rõ về những chủ trương, chính sách đối với việc phát triển CLB/Tổ/Đội/Nhóm, giúp các tổ chức trở thành địa chỉ đáng tin cậy cho sinh viên phát triển bản thân.
Giúp sinh viên hiểu rõ hơn về các loại hình, biết được những lợi ích khi tham gia mỗi loại hình CLB/Tổ/Đội/Nhóm.
Tạo không gian để giải đáp thắc mắc cho sinh viên về các hoạt động của các CLB/Tổ/Đội/Nhóm, từ đó lựa chọn tham gia các hoạt động, tổ chức phù hợp.
Tạo cơ hội trao đổi, thảo luận giữa sinh viên với nhà trường, các đại diện CLB/Tổ/Đội/Nhóm về việc phát triển kĩ năng sinh viên.
Link form khảo sát: tại đây
  Lưu ý: Link Form khảo sát sẽ đóng vào 20h00 ngày 25/10/2024
Các bạn có thể tham khảo các CLB tại đây: https://ctsv.hust.edu.vn/#/clb
-> https://hust.edu.vn/vi/sinh-vien/hoat-dong-cua-sinh-vien/cau-lac-bo-sinh-vien-654597.html","1, Tham gia hoạt động khảo sát thông tin do Đại học thực hiện",Online,08:00 10/09/2024 đến 20:00 25/10/2024,Ban CTSV,20:00 25/10/2024
Lễ chào mừng tân sinh viên K69,"Bạn đã sẵn sàng bước vào một hành trình mới đầy thú vị tại Đại học Bách khoa Hà Nội?
Bạn đã sẵn sàng làm quen với những người bạn mới, gặp gỡ các thầy cô tận tâm, và khám phá những cơ hội học tập, hoạt động ngoại khóa đa dạng? Năm học 2024-2025, Đại học Bách khoa Hà Nội tổ chức một sự kiện đặc biệt để chào đón các bạn tân sinh viên đến với HUST. Năm học 2024-25, Nhà trường tổ chức LỄ CHÀO MỪNG TÂN SINH VIÊN K69 theo kế hoạch như sau: 
Thời gian: 7h00-8h30 Sáng, ngày 6/9/2024;
Địa điểm: Quảng trường C1.
Nội dung:
Văn nghệ chào mừng,
Bài phát biểu của Giám đốc Đại học BKHN,
Khen thưởng các tân sinh viên có thành tích tiêu biểu,
Phát biểu của Tân sinh viên,
Nghi thức trao cờ truyền thống của anh chị khóa trước cho Tân Sinh viên K69,
Chủ tịch hội thể thao ĐHBKHN phát động giải chạy 10,000 bước chân mỗi ngày,
Sinh viên tham dự chạy 01 vòng xung quanh trường theo hướng dẫn của thầy cô Khoa Giáo dục thể chất.
Toàn bộ SV K69 chụp ảnh tập thể tại quảng trường thư viện Tạ Quang Bửu.
Nhà trường trân trọng mời các bạn sinh viên tham dự.
Với các bạn sinh viên K69, Các bạn tập trung lúc 6h30 và thực hiện theo hướng dẫn của Ban tổ chức.
Để minh chứng tham gia sự kiện các bạn:
Check in 2 lần (cách nhau khoảng 30 phút) trong khung giờ 7h - 9h00 tại khu vực tham dự lễ.
Chụp ảnh rõ mặt tại sự kiện. Các bạn có thể thực hiện tải minh chứng ảnh sau khi về nhà, để không bị ảnh hưởng bởi chất lượng kết nối với server không đảm bảo khi số lượng người đăng tải hình ảnh vào hệ thống nhiều.
Ban tổ chức","1, Tham gia giữ gìn an ninh – trật tự, bảo vệ sinh cảnh quan - môi trường, nếp sống văn minh nơi công cộng, quảng bá hình ảnh đẹp của Nhà trường được địa phương, Nhà trường công nhận
2, Tham gia các hoạt động phổ biến, tìm hiểu bản sắc văn hóa dân tộc, văn hóa địa phương, văn hóa trường học,…
3, Tham gia cổ vũ các hoạt động phong trào văn hóa, thể thao",Quảng trường C1,06:00 06/09/2024 đến 09:00 06/09/2024,Đại học Bách Khoa Hà Nội,10:30 06/09/2024
Tuần định hướng của sinh viên K69,"Giới thiệu
Theo Quy chế của Bộ GĐ&ĐT, sinh viên năm thứ nhất cần tham gia các hoạt động của Tuần sinh hoạt công dân (hay Tuần định hướng) để được phổ biến về các thông tin quan trọng trong suốt quá trình học tập. Để tạo ra không khí thoải mái, các hoạt động của Tuần định hướng được xây dựng, thiết kế khoa học để định hướng phát triển những kĩ năng cần thiết cho tân sinh viên, từ tư duy chủ động thích ứng đến khả năng kiến tạo cộng đồng của bản thân. Tuần định hướng 2024 kết hợp giữa nhiều chuyên mục giới thiệu thông tin và các hoạt động từ vấn và trải nghiệm. Bằng việc tích cực tham gia vào các chương trình, tân sinh viên có thể tiếp thu các kinh nghiệm quý báu, làm quen với những người bạn mới, nhận được các phần quà hấp dẫn và trên hết, phát triển năng lực bản thân để sẵn sàng cho hành trình mới tại Đại học Bách khoa Hà Nội.
Tuần định hướng bao gồm các hoạt động chính: (1) Các buổi sinh hoạt hỗ trợ sinh viên tiếp cận với nhiều thông tin bổ ích, giúp các tân sinh viên làm quen với môi trường đại học; (2) Không gian tư vấn trải nghiệm, bao gồm: không gian trải nghiệm dịch vụ công, không gian trải nghiệm ATM quà tặng, không gian giới thiệu các CLB sinh viên, không gian tư vấn lựa chọn sử dụng các sản phẩm và dịch vụ, gian hàng BKSHOP,...; (3) Triển lãm tranh và khu vực “Checkin”. Cụ thể:
Thời gian: 4,5,6,7,14,15/9/2024 (trực tiếp/online), 16/9 – 25/9/2024 (online)
Địa điểm: Khu vực hội trường C2 (trực tiếp) và nền tảng MS Teams (online).
Thành phần:
Lãnh đạo Đại học, Cán bộ Ban/Trung tâm và Đoàn – Hội,
Lãnh đạo và thầy cô của các Trường/Viện,
Sinh viên K69 (khoảng trên 9000 SV),
Diễn giả, khách mời và doanh nghiệp.
Yêu cầu
Tuần định hướng tân sinh viên có 10 buổi với nội dung khác nhau. Sinh viên tham gia trực tiếp 01 buổi tại hội trường C2, còn lại tham gia Online trên nền tảng MS TEAMS. Để hoàn thành các nội dung của Tuần định hướng, sinh viên cần ĐẠT đồng thời 02 điều kiện dưới đây:
Được ghi nhận tham gia 01 buổi trực tiếp tại hội trường C2. Để được ghi nhận sinh viên tham gia theo lịch và thực hiện ghi danh đầy đủ theo yêu cầu.
Được ghi nhận tham gia tối thiểu 06 buổi Online. Để được ghi nhận đã tham gia một buổi Online, thì thời lượng tham gia (theo dõi buổi phát trực tiếp hoặc phát lại trên MS TEAMS) phải trên 75% thời gian của buổi sinh hoạt, do hệ thống ghi nhận.
Sau khi kết thúc Tuần định hướng đầu khóa, sinh viên sẽ thực hiện bài kiểm tra quy chế. Bài kiểm tra bao gồm hơn 80 câu hỏi trắc nghiệm, kiểm tra bằng hình thức online, cách thức và lịch kiểm tra sẽ được gửi vào email cá nhân. Sinh viên trả lời đúng 80% câu hỏi trong bài kiểm tra quy chế sẽ được ghi nhận là ĐẠT.
Nếu sinh viên không hoàn thành các nội dung sinh hoạt của Tuần định hướng theo yêu cầu, hoặc không đạt bài kiểm tra Quy chế, sinh viên sẽ phải học bù hoặc tham gia bài kiểm tra bổ sung, và trả chi phí phát sinh để học và kiểm tra lại (nếu có).
Thời khóa biểu của Tuần định hướng K69 xem tại đây!","1, Tham gia Sinh hoạt công dân do nhà trường tổ chức","C2, MS TEAMS",00:00 04/09/2024 đến 00:00 20/09/2024,Ban CTSV,00:00 20/09/2024
Tham gia đội tình nguyện hỗ trợ hoạt động nhập học K69,"Với mong muốn hỗ trợ các bạn tân sinh viên còn nhiều bỡ ngỡ trong ngày đầu nhập học, trong những ngày nhập học (28, 29 và 30/8) và hoạt động đầu khóa (4,5,6,7, 14, 15/9),  Ban CTSV và các đơn vị càn thêm sự hỗ trợ của các bạn tại khu làm hồ sơ để giúp các bạn tân sinh viên hoàn thành các bước trong thủ tục nhập học, giải đáp những thắc mắc một cách tốt nhất cho hơn 9000 tân sinh viên và phụ huynh trong các hoạt động đầu khóa;
Công việc:
Hỗ trợ thầy cô Ban Công tác sinh viên sắp xếp, ổn định và lấy số thứ tự, phát túi hồ sơ cho tân sinh viên;
Hướng dẫn tân sinh viên, phụ huynh đến các vị trí chờ đã được nhà trường bố trí cho hoạt động nhập học;
Hướng dẫn phụ huynh và sinh viên thực hiện thủ tục đăng ký KTX, nhà trọ, xe bus, địa điểm ăn uống,...
Yêu cầu:
Các bạn có thể tham gia tối thiểu 02 buổi (sáng hoặc chiều), đăng ký vào form sau:
https://forms.office.com/r/94Gky9S57a
Trang phục lịch sự, tốt nhất là áo đồng phục của trường.
Minh chứng: Danh sách sinh viên tham gia tình nguyện do Ban CTSV thêm theo đóng góp thực tế của các bạn.","1, Tham gia hoạt động tình nguyện (mùa hè xanh, tình nguyện tại chỗ, cổng trường ATGT)
2, Tham gia tuyên truyền chủ trương của Đảng, chính sách pháp luật của Nhà nước, quy định của nơi cư trú, quy định và quy chế của nhà trường được địa phương, Nhà trường công nhận
3, Tham gia các hoạt động phổ biến, tìm hiểu bản sắc văn hóa dân tộc, văn hóa địa phương, văn hóa trường học,…","C2, TV TQB",00:00 28/08/2024 đến 00:00 15/09/2024,Ban CTSV,00:00 15/09/2024
Chương trình “Giáo trình trao tay”,"Nhằm hỗ trợ các bạn sinh viên đặc biệt là các bạn K69 mới vào trường, phòng CTSV tổ chức chương trình “Giáo trình trao tay” với mong muốn gửi những cuốn giáo trình, tài liệu các môn học đại cương như: Giải tích, Đại số, Vật Lý,.. không còn dùng nữa để tặng lại các em khóa mới. 
Các giáo trình nhận: Giáo Trình các môn Đại Cương của năm nhất, năm hai thuộc các bộ môn (VLĐC; Toán Cao Cấp; Lý luận chính trị; Lý luận thể dục thể thao, Quàn trị học ĐC, THĐC ). Ngoài ra, các tài liệu luyện thi TOEIC, IELTS… 
Địa điểm nhận sách: D4 – 106 
Thời gian: 12/8/2024 – 1/9/2024
Sáng: 8h – 11h30 
Chiều: 13h30 – 17h 
Số lượng: tối thiểu 5 quyển (Tất cả sách phải còn dùng được, còn nguyên vẹn, không bị rách bìa, không bị mất trang hay quá bẩn).
Minh chứng do BTC xác nhận theo danh sách sinh viên tham gia chương trình","1, Tham gia hoạt động tình nguyện (mùa hè xanh, tình nguyện tại chỗ, cổng trường ATGT)
2, Tham gia phong trào ""cốc trà đá vì cộng đồng"","" tuổi trẻ Bách khoa Nhân ái""",D4 – 106,08:00 12/08/2024 đến 17:00 01/09/2024,Ban CTSV,17:00 01/09/2024
"HỘI NGHỊ KẾT NỐI ĐẦU TƯ, PHÁT TRIỂN CÔNG NGHIỆP BÁN DẪN THÀNH PHỐ HÀ NỘI 2024","Chương trình được tổ chức nhằm mục tiêu tạo kênh trao đổi thông tin thiết thực, hiệu quả nhằm nắm bắt khó khăn, vướng mắc để hỗ trợ các nhà đầu tư, doanh nghiệp ổn định sản xuất, kinh doanh và phát triển bền vững, giới thiệu tiềm năng, thế mạnh, quảng bá hình ảnh thành phố Hà Nội nhằm thu hút đầu tư ngành công nghiệp bán dẫn, công nghệ cao; Xây dựng hình ảnh chính quyền Thành phố năng động, luôn đồng hành, hỗ trợ, tạo điều kiện để các doanh nghiệp phát triển; Tăng cường hoạt động hợp tác, xúc tiến đầu tư, thương mại, giữa các nhà đầu tư, doanh nghiệp của thành phố Hà Nội và các tỉnh, thành phố trong cả nước; Hỗ trợ các nhà đầu tư, doanh nghiệp địa bàn thành phố Hà Nội và các tỉnh, thành phố trong cả nước quảng bá, giới thiệu sản phẩm, dịch vụ; kết nối, tìm kiếm cơ hội hợp tác đầu tư và kinh doanh.
Các hoạt động trong khuôn khổ chương trình:
Ngày 1
Hội nghị kết nối đầu tư, phát triển công nghiệp bán dẫn thành phố Hà Nội 2024
Thời gian: 14:00 – 17:15, ngày 29/7/2024
Địa điểm: Hội trường Tòa nhà C2, Đại học Bách khoa Hà Nội
Ngày 2 - Sáng
Tọa đàm chuyên đề: Tiềm năng và thách thức thu hút đầu tư nước ngoài công nghiệp bán dẫn tại Hà Nội
Thời gian: 8:00 – 11:30, ngày 30/7/2024
Địa điểm: Khu vực đối diện Thư viện Tạ Quang Bửu, Đại học Bách khoa Hà Nội.
Minh chứng: chụp ảnh checkin tại không gian sự kiện.","1, Tham gia hội thảo tăng cường kỹ năng mềm, phương pháp học tập, ý thức học tập, làm việc
2, Tham gia giữ gìn an ninh – trật tự, bảo vệ sinh cảnh quan - môi trường, nếp sống văn minh nơi công cộng, quảng bá hình ảnh đẹp của Nhà trường được địa phương, Nhà trường công nhận",Hội trường C2,14:00 29/07/2024 đến 16:00 03/09/2024,Ban CTSV,16:00 03/09/2024
[2023.2] KHẢO SÁT CẢM NHẬN VÀ TRẢI NGHIỆM VỀ NĂM THỨ NHẤT HỌC ĐẠI HỌC,"Sinh viên năm nhất thường phải đối mặt với rất nhiều khó khăn do sự chuyển đổi môi trường học tập. Những khó khăn trong cuộc sống, đặc biệt là trong học tập, của các bạn luôn là mối bận tâm của Nhà trường, thầy cô và gia đình. Khảo sát ""Cảm nhận và trải nghiệm về năm thứ nhất học đại học"" thu thập những thông tin về các vấn đề gặp phải của sinh viên năm nhất. 
Từ những thông tin thu được, Nhà trường sẽ triển khai các giải pháp khả thi nhằm giúp sinh viên có những trải nghiệm tốt nhất trong năm học đại học thứ nhất. Do đó, Chúng tôi rất mong nhận được các câu trả lời thực tế, khách quan từ các bạn. Việc đóng góp của các bạn sẽ được nhà trường ghi nhận và coi như bạn tham gia một hoạt động nghiên cứu về cảm nhận, trải nghiệm của sinh viên và được cấp MC rèn luyện tương ứng.
Trước khi trả lời các câu hỏi ở Phiếu khảo sát, chúng tôi muốn các bạn lướt qua một số thông tin mang tính tham khảo này:
https://www.timeshighereducation.com/student/advice/real-life-tips-surviving-your-first-year-university
Một số từ khóa: https://res.edu.vn/unit-4-the-first-year-undergraduates-ielts-listening/ 
..
Bạn sãn sàng tham gia nghiên cứu này cùng chúng tôi, hãy điền form:
https://forms.office.com/r/G7ySGhNLkr
Minh chứng tham gia hoạt động được chúng tôi thêm theo danh sách các bạn hoàn thành khảo sát trên.","1, Tham gia hoạt động hướng nghiệp, tìm kiếm thông tin việc làm
2, Có hành động tích cực trên không gian mạng (hoạt động online) phù hợp với chủ trương của Nhà trường, Nhà nước được tập thể ghi nhận
3, Tham gia hoạt động khảo sát thông tin do Đại học thực hiện",MS FORM,00:00 07/07/2024 đến 00:00 22/07/2024,Ban CTSV,00:00 22/07/2024
