title,page_content,criteria,Địa điểm:,Thời gian:,BTC:,Hạn nộp MC:
Chương trình Tham quan Công ty TNHH Hyundai Kefico Việt Nam,"   Công ty TNHH Hyundai Kefico Việt Nam là thành viên của tập đoàn Hyundai Hàn Quốc, chuyên sản xuất các linh kiện điện tử thông minh cho ô tô, là nhà máy công nghệ cao có trụ sở tại KCN Đại An, phường Tứ Minh, TP Hải Dương, tỉnh Hải Dương. Hyundai Kefico Việt Nam được đánh giá là công ty số 1 tại Hải Dương, đồng thời là một trong 8 doanh nghiệp trong cả nước được Thủ tướng Chính phủ Việt Nam trao tặng danh hiệu “Doanh nghiệp tiêu biểu vì người lao động”. Được thành lập vào ngày 19 tháng 09 năm 2009, với hơn 15 năm hình thành và phát triển, Hyundai Kefico Việt Nam luôn không ngừng mở rộng sản xuất, lắp đặt thêm các dây chuyền mới để đáp ứng nhu cầu thị trường ngày càng cao, mang lại cho cán bộ công nhân viên ngày càng nhiều chính sách phúc lợi tốt.
     Ngày 14 tháng 11 năm 2024, Hyundai Kefico Việt Nam chính thức mở thêm Trung tâm Phát triển Phần mềm có địa chỉ tại Tầng 12, Tòa nhà Taisei, 289 Khuất Duy Tiến, Trung Hòa, Cầu Giấy, Hà Nội. Điều này càng khẳng định hơn nữa vị thế của công ty trên toàn thế giới nói chung và tại Việt Nam nói riêng. Bên cạnh đó, cũng mở ra vô vàn cơ hội việc làm hấp dẫn trong lính vực phát triển phần mềm ô tô.
Dành cho sinh viên tất cả các khóa ưu tiên Trường Điện - Điện tử, Cơ khí, Vật liệu.
Các bạn đăng ký: tại đây
CÁC NỘI DUNG CHƯƠNG TRÌNH
Mục đích:
Triển khai các hoạt động định hướng nghề nghiệp từ sớm cho sinh viên
Cung cấp cho sinh viên các thông tin về môi trường làm việc thực tế tại doanh nghiệp sản xuất
Đối tượng tham gia:
Là sinh viên của ĐH Bách khoa Hà Nội;
Thời gian và địa điểm tổ chức:
Thời gian: 7h00 Thứ Năm - Ngày 28 tháng 11 năm 2024
Địa điểm:
+ Địa điểm đón sinh viên: Thư viện Tạ Quang Bửu
+ Địa điểm tham quan: Tại nhà máy Hyundai Kefico Việt Nam – Lô XN01, KCN Đại An, phường Tứ Minh, TP Hải Dương, tỉnh Hải Dương
Số lượng tham gia: tối đa 150 sinh viên /đợt tham quan
Các hoạt động dự kiến triển khai
Thời gian
Hoạt động
06:30
Điểm danh sinh viên tại sảnh Thư viện Tạ Quang Bửu
07:00 – 08:40
Di chuyển từ Hà Nội về Công ty Hyundai Kefico Việt Nam
08:40 – 08:50
Công ty Hyundai Kefico Việt Nam đón tiếp đoàn
08:50 – 09:05
Bắt đầu chương trình & Đại diện Công ty phát biểu chào mừng
09:05 – 09:30
-    Giới thiệu về Công ty
-    Giới thiệu về Công việc Kỹ sư tại nhà máy
  09:30 – 09:40
Tea break
09:40 – 10:30
Tham quan nhà máy
10:30 – 10:45
Q&A
10:45 – 11:10
Kết thúc nội dung tham quan, tặng quà & chụp ảnh
11:10 ~ 12:00
Ăn trưa
12:00
Đoàn trở về Hà Nội
Lưu ý:
Sinh viên tập trung đúng giờ, tuân thủ điều phối của Ban tổ chức
Lưu ý về trang phục (mặc đồng phục trường) và phát ngôn trong quá trình đi tham quan","1, Tham gia hội thảo tăng cường kỹ năng mềm, phương pháp học tập, ý thức học tập, làm việc
2, Tham gia hoạt động hướng nghiệp, tìm kiếm thông tin việc làm",Sảnh Thư viện Tạ Quang Bửu,07:00 28/11/2024 đến 14:00 28/11/2024,"Tổ hỗ trợ thực tập, việc làm doanh nghiệp",14:00 28/11/2024
Hội thảo: Cooler Master x Thermal Solutions x Future,"Tập đoàn Cooler Master (Đài Loan) được thành lập năm 1992 với trụ sở ở Đài Bắc, Đài Loan. Cooler Master có hoạt động tại 37 quốc gia và vùng lãnh thổ, tập đoàn cung cấp giải pháp tản nhiệt cho các khách hàng doanh nghiệp hoạt động trong các lĩnh vực sau: thiết bị AI, y tế, giáo dục, logistics, trồng trọt, sản xuất, giao thông, vv. Những sản phẩm sử dụng chip AI như xe điện thông minh, các thiết bị đeo tay... các bạn sẽ đều thấy sự hiện diện của Cooler Master ở đó.
Hiện tại Cooler Master đầu tư nhà máy sản xuất tại khu công nghiệp Gia Bình I, xã Đông Cứu, huyện Gia Bình tỉnh Bắc Ninh với quy mô đầu tư 200 triệu đô la Mỹ, gần 100,000 mét vuông. Trong tương lai, Việt Nam sẽ là nhà máy trọng điểm của tập đoàn Cooler Master trên thế giới.
Để có cơ hội chia sẻ các thông tin công nghệ liên quan và cơ hội việc làm tại Cooler Master, Tập đoàn đã trao đổi với Lãnh đạo Đại học BKHN để tổ chức buổi Hội thảo ""Cooler Master x Thermal Solutions x Future"" theo kế hoạch như sau:
Thời gian: 13h30 - 17h00, ngày 27 tháng 11 năm 2024
Địa điểm: Hội trường C2, Đại học BKHN
Tại buổi hội thảo các bạn sinh viên sẽ được các lãnh đạo cấp cao của Cooler Master (hội sở) chia sẻ các nội dung:
Chia sẻ của giám đốc kinh doanh cấp cao của tập đoàn về xu hướng ngành tản nhiệt và Cooler Master;
Chia sẻ của 2 Trưởng nhóm kỹ thuật của tập đoàn về công nghệ và sản phẩm;
Chia sẻ của 1 bạn cựu sinh viên ĐHBK Hà Nội (hiện tại đang làm R&D engineer tại Cooler Master);
Chia sẻ của HR về cơ hội việc làm. Các bạn có thể quét mã QR để điền thông tin CV, có cơ hội tham gia phỏng vấn trực tiếp tại sự kiện ngày hội việc làm ngày 8/12/2024.
Ngoài ra các bạn có cơ hội nhận quà tặng khi:
Quét mã và điền thông tin doanh nghiệp quan tâm, hay
Đặt câu hỏi, trả lời câu hỏi với các diễn giả hoặc
Tham gia trải nghiệm sản phẩm (PC hình chiếc giầy và hình cá mập, xe đua).
Minh chứng: Chụp ảnh và checkin 02 lần cách nhau 30 phút tại sự kiện. Trang phục lịch sự khi tham gia sự kiện.","1, Tham gia hoạt động, sự kiện liên quan đến NCKH, học thuật, chuyên môn
2, Tham gia hội thảo tăng cường kỹ năng mềm, phương pháp học tập, ý thức học tập, làm việc
3, Tham gia hoạt động hướng nghiệp, tìm kiếm thông tin việc làm",Hội trường C2,13:00 27/11/2024 đến 16:00 27/11/2024,Ban CTSV,16:00 27/11/2024
Khóa học Kỹ năng mềm tin học văn phòng dành cho sinh viên kỳ 2024-1,"Microsoft 365 là một bộ công cụ và dịch vụ dựa trên đám mây của Microsoft, bao gồm các ứng dụng quen thuộc như Word, Excel, PowerPoint, và nhiều hơn nữa. Khóa học nhằm mục đích giúp sinh viên làm việc hiệu quả hơn, quản lý thông tin và dữ liệu một cách khoa học, nâng cao kỹ năng làm việc nhóm, tạo tài liệu chuyên nghiệp, và tăng cường sự tự tin trong môi trường làm việc hiện đại. 
Đối tượng tham gia: Sinh viên đang học tập tại Đại học Bách khoa Hà Nội. 
Thời gian diễn ra chương trình: 20/11/2024 – 30/12/2024. 
Địa điểm: Offline tại Đại học Bách khoa Hà Nội. 
Nội dung khóa học 
Khóa học gồm hai nội dung chính: 
Khóa học KNM Excel. 
Khóa học KNM PowerPoint. 
Khóa học KNM Word. 
Yêu cầu: Mỗi học viên phải hoàn thành các yêu cầu đầu vào và đầu ra để được xác nhận tham gia khóa học. 
Thể lệ và quyền lợi 
Thể lệ: Sinh viên đăng ký qua form, và hoàn thành đủ điểm đầu ra. 
Quyền lợi: Sinh viên hoàn thành khóa học sẽ được xác nhận hoạt động rèn luyện và cấp giấy chứng nhận. 
Giải thưởng: Tất cả học viên đạt yêu cầu sẽ được công nhận hoàn thành khóa học và nhận giấy chứng nhận hoạt động (bản cứng). 
Các bạn đăng ký tại đây: https://forms.office.com/r/ZYs2LsBfp2 
Minh chứng:
Theo danh sách của BTC chương trình.
Chúc các bạn học tập vui vẻ và đạt được kết quả tốt! ","1, Tham gia khóa đào tạo kỹ năng mềm",Đại học Bách khoa Hà Nội,08:00 20/11/2024 đến 17:00 18/12/2024,Ban CTSV,17:00 18/12/2024
[2024.1] Tham gia các hoạt động khảo sát lấy ý kiến của sinh viên,"Để có thể tổ chức tố các hoạt động chăm lo cho sinh viên, Nhà trường luôn cần nhận được các ý kiến đánh giá của các bạn sinh viên đã có các trải nghiệm trong các hoạt động, dịch vụ do Nhà trường hoặc các đơn vị liên quan cung cấp, cụ thể:
I. Khảo sát ""Nhu cầu hướng nghiệp, giới thiệu việc làm, đào tạo tiếng Anh và kỹ năng mềm cho sinh viên"" những thông tin thu thập nhằm giúp nâng cao hiệu quả hoạt động trong thời gian tới. Hoạt động khảo sát sẽ được thực hiện hàng kỳ, để cung cấp thông tin định hướng hoạt động các đơn vị trong thời gian tiếp sau.
Link khảo sát: https://forms.office.com/r/aTAzpT49Mi
II. Thực hiện ""Góp phần xây dựng một môi trường học tập và rèn luyện tốt hơn cho Sinh viên"", do Hội Sinh viên Đại học triển khai việc thu thập ý kiến, đánh giá của các bạn sinh viên về các hoạt động của Nhà trường liên quan đến sinh viên trong năm 2024. Hội Sinh viên mong muốn bạn tham gia, đóng góp ý kiến một cách tâm huyết và trách nhiệm nhất để môi trường học tập cho sinh viên ĐHBK Hà Nội ngày một  hoàn thiện hơn.
Link khảo sát: https://forms.office.com/r/FdhPBAabTS
III. Khảo sát ""Cảm nhận và trải nghiệm về năm thứ nhất học đại học"" thu thập những thông tin về các vấn đề gặp phải của sinh viên năm nhất. Từ những thông tin thu được, Nhà trường sẽ triển khai các giải pháp khả thi nhằm giúp sinh viên có những trải nghiệm tốt nhất trong năm học đại học thứ nhất. Do đó, Chúng tôi rất mong nhận được các câu trả lời thực tế, khách quan từ các bạn. Việc đóng góp của các bạn sẽ được nhà trường ghi nhận và coi như bạn tham gia một hoạt động nghiên cứu về cảm nhận, trải nghiệm của sinh viên và được cấp MC rèn luyện tương ứng.
Link khảo sát: https://forms.office.com/r/D9JC8PGL95
IV. Khảo sát ""Sinh viên là thế hệ đầu của gia đình đi học đại học"" nhằm mục đích thu thập dữ liệu từ người học phục vụ việc nộp hồ sơ xếp hạng THE, Ban CTSV  gửi tới bạn một khảo sát nhanh gồm 5 câu hỏi form khảo sát đã được gửi qua email của từng bạn. Thực hiện khảo sát này, giúp bạn góp phần phát triển Nhà trường, đồng thời được ghi nhận cấp MC đánh giá rèn luyện, do đó Nhà trường mong nhận được các câu trả lời chính xác từ các bạn.
Link khảo sát: https://forms.office.com/r/AUfeQ04dBq
Để được cấp MC cho hoạt động này:
Với K69, 68 để được cấp MC cho hoạt động này các bạn cần thực hiện đầy đủ 4 khảo sát trên.
Với các khóa còn lại các bạn thực hiện các khảo sát I, II.
Hạn thực hiện 15.12.2024.","1, Có hành động tích cực trên không gian mạng (hoạt động online) phù hợp với chủ trương của Nhà trường, Nhà nước được tập thể ghi nhận
2, Tham gia hoạt động khảo sát thông tin do Đại học thực hiện",MS Form,00:00 20/11/2024 đến 00:00 15/12/2024,Ban CTSV,00:00 15/12/2024
Kiểm tra quy chế kỳ 2024.1,"Nhằm mục tiêu giúp sinh viên nắm vững quy định, quy chế, Nhà trường đã tổ chức Tuần sinh hoạt công dân và ban hành tài liệu Sổ tay sinh viên. Để đánh giá việc nắm vững các thông tin quan trọng phục vụ cho việc học tập tại Đại học Bách khoa Hà Nội, Nhà trường yêu cầu sinh viên hoàn thành bài kiểm tra quy chế.
Cụ thể:
Bài kiểm tra quy chế bao gồm 110 câu hỏi trắc nghiệm.
Đề đạt bài thi này các bạn phải trả lời đúng tối thiểu 80 câu trong vòng 100 phút. Hết thời gian 100 phút MS Form tự động nộp bài.
Sinh viên sẽ thực hiện bài kiểm tra từ 07h00 ngày 26/10/2024 đến 22h00 ngày 1/12/2024.
Sinh viên chỉ được trả lời 1 lần, do vậy khi hết 100 phút kết quả sẽ được ghi nhận, bạn không thể làm lại.
Ngày 15/12/2024 Ban CTSV sẽ gửi thông tin các bạn đạt trên trang ctsv.hust.edu.vn
Lưu ý:
Các bạn có thể tìm kiếm câu trả lời cho mình trong tài liệu Sổ tay công tác sinh viên, các bài đăng chính thống trên website, và hỏi ý kiến trên các diễn đàn. Bạn chịu trách nhiệm với câu trả lời của bạn.
Link thực hiện bài kiểm tra quy chế kỳ 2024.1: https://forms.office.com/r/Tgx7A5Nb8Q
Hết thời gian 100 phút MS Form tự động nộp bài.
Chúc các bạn làm bài kiểm tra tốt!","1, Nắm vững quy định và quy chế của Nhà trường",MS FORM,00:00 26/10/2024 đến 00:00 01/12/2024,Ban CTSV,00:00 01/12/2024
Tìm hiểu về Pháp luật kỳ 2024.1,"Triển khai Quyết định số 691/QĐ- BGDĐT ngày 11 tháng 3 năm 2022 của Bộ Giáo dục & Đào tạo ban hành Kế hoạch thực hiện Chương trình phòng, chống tội phạm trong ngành Giáo dục đến năm 2025 và định hướng đến năm 2030; Triển khai Kế hoạch  số 1285/KH-BGDDT ngày 02/8/2023 về việc thực hiện Dự án “Phòng ngừa tội phạm và phòng, chống vi phạm pháp luật cho học sinh, sinh viên đến năm 2025, định hướng đến năm 2030”; Thực hiện Quyết định số 435/QĐ-BGDĐT ngày 30/1/2024 của Bộ Giáo dục & Đào tạo về Công tác phổ biến, giáo dục pháp luật năm 2024 của ngành giáo dục; Kế hoạch 243- KH-BGDĐT về triển khai Chương trình công tác về phòng, chống tội phạm, vi phạm pháp luật, HIV/AIDS, ma túy, mại dâm trong Ngành giáo dục năm 2024.
Đại học Bách khoa Hà Nội tổ chức cuộc thi trực tuyến trên mạng Internet “Tìm hiểu về Pháp luật kỳ 2024.1”, với mục tiêu: 
Tuyên truyền rộng rãi các quy định của pháp luật liên quan đến sinh viên; Góp phần nâng cao ý thức tuân thủ pháp luật trong sinh viên.
Tạo điều kiện để sinh viên tìm hiểu về luật Giáo dục, luật an toàn giao thông, luật an ninh mạng, pháp luật về phòng chống tệ nạn xã hội, luật phòng chống tham nhũng, luật pháp liên quan giáo dục an ninh quốc phòng, luật sở hữu trí tuệ, phòng cháy chữa cháy...
Bài kiểm tra gồm 120 câu hỏi trắc nghiệm, 1 câu hỏi tự luận. Các câu hỏi trắc nghiệm được xây dựng dựa trên sự tham khảo, tổng hợp từ các cuộc thi tìm hiểu Pháp luật Online liên quan tới các nội dung pháp luật về: luật Giáo dục, luật An toàn giao thông, luật An ninh mạng, Pháp luật về phòng chống tệ nạn xã hội, luật Phòng chống tham nhũng, luật Sở hữu trí tuệ, luật phòng cháy chữa cháy.

Người dự thi thao tác như sau:
Truy cập vào bài đăng về Cuộc thi được công bố trên trang thông tin của Đại học http://hust.edu.vn hoặc http://ctsv.hust.edu.vn;
Kích vào bài kiểm tra của Cuộc thi “Tìm hiểu Pháp luật kỳ 2024.1” và trả lời các câu hỏi bằng cách lựa chọn một trong các đáp án;
Sau khi trả lời xong câu hỏi bấm vào ô “Gửi” để kết thúc dự thi, mỗi thí sinh chỉ được trả lời 1 lần.
Kết quả kiểm tra của mỗi người là bài thi được tính bằng số câu trả lời trắc nghiệm đúng, câu tự luận có nội dung đạt và tổng thời gian trả lời (thời gian tính đến ngày, giờ, phút, giây). Trong trường hợp 02 người dự thi (trở lên) có cùng số câu trắc nghiệm được trả lời đúng, đạt câu hỏi tự luận và có cùng có tổng thời gian trả lời bằng nhau thì Ban tổ chức sẽ chấm điểm câu trả lời tự luận để quyết định người đạt giải cao hơn.

Để được cấp MC phục vụ cho việc đánh giá rèn luyện: SV cần có 60% câu trả lời đúng.
Để làm bài, bạn click vào đường link sau: https://forms.office.com/r/sH1Tj2DC4H
Mọi vấn đề cần phản hồi liên quan đến cuộc thi, các bạn gửi về địa chỉ ctsv@hust.edu.vn để BTC tổng hợp, xử lý và báo cáo các đơn vị, cá nhân liên quan.","1, Hiểu biết và chấp hành pháp luật của Nhà nước, quy định của nhà trường và nơi cư trú",MS Form,00:00 22/10/2024 đến 00:00 30/11/2024,Ban CTSV,00:00 30/11/2024
Cuộc thi bình chọn trực tuyến “Đại sứ truyền thông cùng HUSTER đi xe buýt”,"1. Giới thiệu:
Năm học 2024 - 2025, Đại học Bách khoa Hà Nội khuyến khích sinh viên tích cực sử dụng xe buýt nhằm góp phần giảm ùn tắc giao thông, ô nhiễm môi trường và rèn luyện bản thân. Thông qua cuộc thi Cuộc thi bình chọn trực tuyến “Đại sứ truyền thông cùng HUSTER đi xe buýt”, Ban tổ chức mong muốn phát động các bạn sinh viên gửi bài dự thi dạng video, ảnh chụp, ảnh vẽ, sáng tác thơ, bài hát… về nét đẹp HUSTer đi xe buýt tới Ban tổ chức để đưa lên bình chọn online trên mạng xã hội nhằm khuyến khích sinh viên tích cực sử dụng phương tiện công cộng, dự kiến thu hút 1000 lượt sinh viên đăng ký tham dự.
2. Đối tượng tham gia: Tất cả người học đang học tập tại Đại học Bách khoa Hà Nội.
3. Tiến trình: Cuộc thi gồm chia thành 03 đợt ghi nhận thành tích và công bố giải thưởng theo kế hoạch như sau:
Tháng 10:
Thời hạn nhận bài dự thi 23h00 ngày 8/10/2024.  
Thời gian bình chọn: Từ 10/10/2024 đến 15h00 ngày 17/10/2024.
Công bố giải: 20/10/2024.
Tháng 11:
Thời hạn nhận bài dự thi 23h00 ngày 8/11/2024.  
Thời gian bình chọn: Từ 10/11/2024 đến 15h00 ngày 17/11/2024.
Công bố giải: 20/11/2024.
Tháng 12:
Thời hạn nhận bài dự thi 23h00 ngày 8/12/2024.  
Thời gian bình chọn: Từ 10/12/2024 đến 15h00 ngày 17/12/2024.
Công bố giải: 20/12/2024.
4. Thể lệ cuộc thi
Thí sinh tham gia cuộc thi là sinh viên và học viên đang học tại Đại học Bách Khoa Hà Nội, thỏa mãn điều kiện:
Là sinh viên tích cực tham gia sử dụng phương tiện giao thông công cộng (được cấp minh chứng tham gia hoạt động “[2024.1] Sinh viên tích cực sử dụng phương tiện giao thông công cộng”).
Có sản phẩm truyền thông có thể là: video, ảnh chụp, ảnh vẽ (có kèm lời bình <100 từ) hoặc thơ, bài hát (kèm hình ảnh minh hoạ) về chủ đề sinh viên Bách khoa với nét đẹp văn hoá đi phương tiện công cộng (xe buýt và 2 tuyến đường sắt đô thị).
Lưu ý: Video định dạng .mp4 có thời lượng không quá 3 phút, âm thanh rõ ràng, không tạp âm, không bị vi phạm bản quyền âm thanh. Hình ảnh: Rõ nét, không mờ nhòe, không có hình ảnh phản cảm.
Tác phẩm dự thi nộp tại: https://forms.office.com/r/4c8uLjWPJA
Các tác phẩm dự thi của thí sinh gửi về sẽ được đăng tải để bình chọn trên fanpage của cuộc thi:  https://www.facebook.com/ctsv.hust.edu.vn/  
Bài dự thi được đánh giá thông qua: 
50% tính trên số lượng tương tác (lượt thích/like hệ số 1; lượt yêu thích/tim, thương thương và wow hệ số 2);
50% theo đánh giá của Ban tổ chức (Ban tổ chức chỉ xét giải cho các sản phẩm có trên 100 tương tác). 
Lưu ý: Các bài dự thi dùng công cụ tăng tương tác và các bài dự thi có lượt tương tác lơn hơn 60% lượt tiếp cận của Post sẽ không được xét giải. Trong mọi trường hợp, quyết định của Ban tổ chức là quyết định cuối cùng.
5. Quyền lợi của thí sinh
Thí sinh dự thi có tác phẩm được xếp hạng Nhất, Nhì, Ba và Khuyến khích sẽ được nhận một phần thưởng tương ứng như sau:
01 giải Nhất, mỗi giải Nhất tháng được một phần thưởng giá trị tương đương 10 tháng vé buýt liên tuyến (trị giá 1triệu đồng/giải); 
02 giải Nhì, mỗi giải Nhì tháng được một phần thưởng giá trị tương đương 5 tháng vé buýt liên tuyến (trị giá 500k đồng/giải); 
03 giải Ba, mỗi giải Ba tháng được một phần thưởng giá trị tương đương 3 tháng vé buýt liên tuyến (trị giá 300k đồng/giải); 
20 giải Khuyến khích, mỗi giải khuyến khích được một phần thưởng giá trị tương đương 2 tháng vé buýt liên tuyến (trị giá 200k đồng/giải); 
Sinh viên tham gia cuộc thi Cuộc thi bình chọn trực tuyến “Đại sứ truyền thông cùng HUSTER đi xe buýt” đảm bảo các yêu cầu theo thể lệ cuộc thi sẽ được cấp minh chứng đánh giá kết quả rèn luyện với tiêu chí: 
“Tham gia các cuộc thi biểu diễn văn hóa văn nghệ được tổ chức bởi các đơn vị hợp pháp (hát, múa, nhảy, đàn, sáo, vẽ tranh,…)” (6 điểm); hoặc
“Tham gia tuyên truyền chủ trương của Đảng, chính sách pháp luật của Nhà nước, quy định của nơi cư trú, quy định và quy chế của nhà trường được địa phương, nhà trường công nhận” (4 điểm); hoặc
Với sinh viên được giải sẽ được cấp thêm minh chứng tương ứng với tiêu chí: “Đạt giải trong các cuộc thi chính thức cấp Đại học, cấp Thành phố, cấp Quốc gia, Quốc tế” (4 điểm).
Minh chứng tham gia cuộc thi: theo danh sách ban tổ chức cung cấp.","1, Tham gia các cuộc thi biểu diễn văn hóa văn nghệ được tổ chức bởi các đơn vị hợp pháp (hát, múa, nhảy, đàn, sáo, vẽ tranh,…).
2, Tham gia tuyên truyền chủ trương của Đảng, chính sách pháp luật của Nhà nước, quy định của nơi cư trú, quy định và quy chế của nhà trường được địa phương, Nhà trường công nhận",Mạng xã hội,08:00 02/10/2024 đến 17:00 30/12/2024,Ban CTSV,17:00 30/12/2024
