title,page_content,criteria,Địa điểm:,Thời gian:,BTC:,Hạn nộp MC:
Tuần lễ giao lưu văn hóa quốc tế,"Tuần lễ giao lưu văn hóa là sự kiện đặc biệt được tổ chức bởi Trung tâm Khảo thí Ngoại ngữ và Trao đổi văn hóa (CLC) nhằm tạo cơ hội cho sinh viên giao lưu, tìm hiểu và trải nghiệm những nét văn hóa đặc sắc của các quốc gia trong khu vực và trên thế giới như Lào, Campuchia, Nhật Bản, Hàn Quốc, Ấn Độ, Đức, Mĩ, …
Tuần lễ giao lưu văn hóa sẽ kéo dài từ 20/5/2024 đến 25/5/2024 và được tổ chức tại nhiều địa điểm trong Đại học Bách Khoa Hà Nội. Đến với sự kiện lần này, các bạn sinh viên sẽ được đắm mình vào không gian văn hóa các nước qua những buổi chiếu phim và triển lãm miễn phí, được tìm hiểu về ngôn ngữ, văn hóa lẫn cơ hội du học nước ngoài qua các workshop thiết thực, và đặc biệt hơn cả là được tham gia các trò chơi, thưởng thức đặc sản lẫn các tiết mục biểu diễn đặc sắc tại hội trại.
Những hoạt động đang chờ đón các bạn tại Tuần lễ giao lưu văn hóa:
Chiếu phim miễn phí (Phòng 101, tòa D2C): Trong khung giờ 17h30 - 19h30 các ngày trong tuần bắt đầu từ 20/5 đến 23/5, các bạn có thể lần lượt tận hưởng những bộ phim kinh điển thấm nhuần đặc sắc văn hóa của Nhật Bản, Hàn Quốc, Ấn Độ và Mỹ.
Link đăng kí: https://forms.gle/ghyMrLgpmidoj7Wt5
Triển lãm văn hóa (tòa D2C): Mở cửa miễn phí từ 8h30 - 10h30 và 14h30 - 16h30 trong các ngày từ 20 đến 24/5, triển lãm trưng bày những vật phẩm biểu tượng cho văn hoá của các quốc gia trên thế giới.
Workshop (tòa D2C): Tham gia chuỗi Workshop trong sự kiện, các bạn không chỉ có cơ hội tìm hiểu thêm về văn hóa các nước mà còn tiếp cận thông tin về các loại học bổng vô cùng có giá trị:
Intercultural Training: ngày 21/5, 10h30 - 11h30, phòng 304
Techno Workshop: ngày 23/5, 14h - 16h, phòng 203
Exploring US Education and Scholarship Opportunities: ngày 23/5, 15h - 16h30, phòng 205
Painting Workshop: ngày 24/5, 9h - 11h, phòng 203
Các hoạt động khác (tòa D2C):
Giao lưu cùng CLB tiếng Đức (Phòng 203, tòa D2C): Vào ngày 22/5, buổi sinh hoạt hàng tuần lúc 17h - 18h của CLB tiếng Đức sẽ mở cửa chào đón mọi người cùng đến giao lưu, tham gia cuộc thi “Rung chuông vàng” và nhận quà.
Lớp học trải nghiệm tiếng Đức (Phòng 203, tòa D2C): Ngày 24/5, các bạn có thể tham dự lớp học tiếng Đức từ 14h đến 15h để trải nghiệm việc học ngôn ngữ này.
Thứ Bảy, ngày 25/5 - Sự kiện chính của tuần lễ từ 8h đến 14h gồm các hoạt động:
Hội trại văn hóa, ẩm thực các nước (Anh, Pháp - Mexico, Đức, Nhật, Hàn, Trung, Ấn Độ, Campuchia, Lào, Việt Nam, Myanmar)
Biểu diễn văn nghệ: Nhảy Yosakoi, Kpop, Sáo trúc, múa Lào, múa Ấn Độ
Mọi thông tin về chương trình xin vui lòng liên hệ:
Trung tâm Khảo thí Ngoại ngữ và Trao đổi Văn hóa - Đại học Bách khoa Hà Nội
email: clc2@hust.edu.vn
Lưu ý: Minh chứng hoạt động theo sự hướng dẫn của BTC","1, Tham gia hội thảo tăng cường kỹ năng mềm, phương pháp học tập, ý thức học tập, làm việc
2, Tham gia các hoạt động phổ biến, tìm hiểu bản sắc văn hóa dân tộc, văn hóa địa phương, văn hóa trường học,…","Sân C2, tòa nhà D2C (Trung tâm Việt Đức)",08:00 20/05/2024 đến 14:00 25/05/2024,Trung tâm Khảo thí ngoại ngữ và Trao đổi văn hóa,18:00 25/05/2024
Đăng ký chương trình tham quan thực tế Công ty POLARIS Việt Nam,"GIỚI THIỆU CHUNG VỀ CÔNG TY:
Tại Polaris, chúng tôi rất tự hào về lịch sử của mình với tư cách là người tiên phong trong các dòng xe thể thao quyền lực; hiện tại chúng tôi tự tin đang là người dẫn đầu toàn cầu trong toàn ngành. Chúng tôi luôn tạo ra các sản phẩm thông qua những trải nghiệm nâng cao, các thương hiệu truyền cảm hứng và những đổi mới hướng tới người sử dụng, được hỗ trợ bởi những nhân tài và thông minh nhất trong toàn ngành.
Chúng tôi xây dựng một môi trường làm việc nhân viên được trao quyền, được đưa ra quyết định và khuyến khích những ý tưởng khác biệt – THINK OUTSIDE
Hiện tại tập đoàn có 20 nhà máy trên toàn cầu tại Châu Mỹ, Châu Âu, Châu Á; trong đó, chúng tôi có 2 nhà máy được đặt tại Vĩnh Phúc, Việt Nam, tại đây, chúng tôi sản xuất Linh kiện cho các dòng xe Powersport (xe trượt tuyết, cano, xe off-road, slingshot,xe mô tô phân khối lớn,…) và lắp ráp hoàn chỉnh xe mô tô Phân khối lớn Indian Motorcycle, các sản phẩm này được xuất khẩu toàn bộ sang Hoa Kỳ.
Nhận thấy mức độ tiềm năng của thị trường Việt Nam, tập đoàn đang đẩy mạnh đầu tư, chúng tôi đang liên tục tìm kiếm nhân tài cho tất các vị trí - các bạn trẻ, năng động sáng tạo và tài năng, để cùng nhau tiếp tục xây dựng văn hóa làm việc phong cách Mỹ, một môi trường công bằng, bình đẳng và phát triển không ngừng.
Đăng ký tham dự: tại đây
CÁC NỘI DUNG CHƯƠNG TRÌNH
Mục đích:
Triển khai các hoạt động định hướng nghề nghiệp từ sớm cho sinh viên
Cung cấp cho sinh viên các thông tin về môi trường làm việc thực tế tại doanh nghiệp sản xuất
Đối tượng tham gia:
Là sinh viên của ĐH Bách khoa Hà Nội;
Thời gian và địa điểm tổ chức:
Thời gian: 7h00 ngày 17 tháng 05 năm 2024
Địa điểm đón sinh viên: Sảnh Thư viện Tạ Quang Bửu
+ Địa điểm tham quan: Tại nhà máy Polaris Vietnam – KCN Bá Thiện II, Bình Xuyên, Vĩnh Phúc
Số lượng tham gia: tối đa 80 sinh viên /đợt tham quan
MINH CHỨNG THAM GIA HOẠT ĐỘNG:
Thực hiện theo hướng dẫn của BTC tại chương trình.","1, Tham gia hội thảo tăng cường kỹ năng mềm, phương pháp học tập, ý thức học tập, làm việc
2, Tham gia hoạt động hướng nghiệp, tìm kiếm thông tin việc làm",Sảnh Thư viện Tạ Quang Bửu,07:00 17/05/2024 đến 15:00 17/05/2024,"Tổ hỗ trợ thực tập, việc làm doanh nghiệp",15:00 17/05/2024
Chương trình tham quan thực tế công ty TNHH New Wing Interconnect Technology (Bắc Giang),"Thời gian: 07h00 Thứ Năm ngày 09 tháng 05 năm 2024
Địa điểm: Sảnh Thư viện Tạ Quang Bửu
Đăng ký tham gia: tại đây
GIỚI THIỆU CHUNG VỀ CÔNG TY:
Là công ty con của tập đoàn Khoa học kỹ thuật Hồng Hải . Là nhà cung ứng linh kiện tinh xảo,chuyên nghiệp có vị trí hàng đầu trên thế giới, trên 10 năm được bình chọn doanh nghiệp đứng đầu trong lĩnh vực khoa học công nghệ máy tính và các sản phẩm tích nối quang học
CÁC NỘI DUNG CHƯƠNG TRÌNH
Mục đích:
Triển khai các hoạt động định hướng nghề nghiệp từ sớm cho sinh viên
Cung cấp cho sinh viên các thông tin về môi trường làm việc thực tế tại doanh nghiệp sản xuất
Đối tượng tham gia:
Là sinh viên của ĐH Bách khoa Hà Nội (SV toàn đại học)
+ Địa điểm tham quan: Công ty TNHH New Wing Inteconnect Technology
(KCN Vân Trung- Phường Vân Trung-Thị xã Việt Yên-Tỉnh Bắc Giang)
MINH CHỨNG THAM GIA HOẠT ĐỘNG:
Thực hiện theo hướng dẫn của BTC tại chương trình.","1, Tham gia hội thảo tăng cường kỹ năng mềm, phương pháp học tập, ý thức học tập, làm việc
2, Tham gia hoạt động hướng nghiệp, tìm kiếm thông tin việc làm",Sảnh Thư viện Tạ Quang Bửu,07:00 09/05/2024 đến 12:00 09/05/2024,"Tổ hỗ trợ thực tập, việc làm doanh nghiệp",12:00 09/05/2024
Giới thiệu học bổng trao đổi đi thực tập tại Tập đoàn Itoki Nhật Bản hè 2024,"Mời các bạn sinh viên có quan tâm tham dự chương trình ""Giới thiệu học bổng trao đổi đi thực tập tại Tập đoàn Itoki Nhật Bản hè 2024""
Chương trình trao đổi thực tập và tuyển dụng của Tập đoàn Itoki Nhật Bản dự kiến sẽ triển khai liên tục trong nhiều năm đối với nhiều đối tượng sinh viên ĐHBK Hà Nội và được ĐHBK Hà Nội công nhận tính tín chỉ thực tập.
  Chi tiết về học bổng xem tại đây: https://ctsv.hust.edu.vn/#/hoc-bong/126/chi-tiet
  Các bạn sinh viên có quan tâm tham dự chương trình để nắm chắc thông tin ứng tuyển năm 2024 hoặc chuẩn bị hồ sơ ứng tuyển những năm tiếp theo nhé.
Thông tin đăng kí tham gia tại đây: https://forms.office.com/r/xW2TAuiL2K
  Ưu tiên các sinh viên có kế hoạch thực tập tại Nhật Bản, và có đăng ký danh sách tham gia sớm.
  Minh chứng: sinh viên chụp ảnh và checkin 2 lần.","1, Tham gia hội thảo tăng cường kỹ năng mềm, phương pháp học tập, ý thức học tập, làm việc
2, Tham gia hoạt động hướng nghiệp, tìm kiếm thông tin việc làm",Hội thảo C2,07:30 25/04/2024 đến 12:00 25/04/2024,Ban CTSV,12:00 25/04/2024
Chương trình tham quan thực tế tại Tập Đoàn Công nghiệp Viễn thông Quân Đội (Viettel Group),"Thời gian: 12h00 đến 16h30 thứ Tư ngày 24 tháng 04 năm 2024
Địa điểm: Sảnh Thư viện Tạ Quang Bửu
Đối tượng: Ưu tiên các bạn sinh viên năm thứ 2 đến năm cuối.
Đăng ký tham gia: tại đây
GIỚI THIỆU VỀ CÔNG TY:
Tập đoàn Công nghiệp - Viễn thông Quân đội (Viettel) có địa chỉ tại Lô D26, Khu đô thị mới Cầu Giấy, phường Yên Hòa, quận Cầu Giấy, Hà Nội. Viettel là nhà cung cấp dịch vụ số toàn cầu, luôn đi đầu trong đổi mới sáng tạo và luôn lắng nghe, thấu hiểu để đem tới những dịch vụ tốt nhất cho khách hàng.
Viettel - Nơi làm việc tốt nhất Việt Nam trong 6 năm liên tiếp trong ngành Viễn thông, Hạ tầng, IT (theo khảo sát Anphabe) là tập đoàn công nghệ hàng đầu Việt Nam, top 18 công ty viễn thông toàn cầu với gần 70.000 nhân viên và hoạt động tại 11 thị trường trải dài từ Châu Á, Châu Mỹ, Châu Phi. Bên cạnh viễn thông, Viettel còn tham gia vào lĩnh vực nghiên cứu sản xuất công nghệ cao, phát triển ứng dụng công nghệ số, hàng không vũ trụ, công nghệ Bán dẫn và nhiều lĩnh vực khác.
Viettel tôn vinh những giá trị khác biệt và bản sắc riêng của mỗi cá nhân, cùng sự gắn kết tương quan của những nét riêng ấy trong cộng đồng và tập thể. Viettel ủng hộ sự đa dạng và hòa hợp trên tinh thần công nhận, khuyến khích và thúc đây tư duy khác biệt để phát triển nhân tài.
Viettel là tập đoàn có thương hiệu giá trị nhất Việt Nam, Viettel giữ vững tinh thần đi đầu trong đổi mới sáng tạo và luôn lắng nghe, thấu hiểu để đem tới những dịch vụ tốt nhất cho khách hàng, quy tụ những tài năng hàng đầu trong mọi lĩnh vực để không ngừng sáng tạo, khám phá, đưa ra những ý tưởng giúp phát triển hệ sinh thái sản phẩm – dịch vụ Viettel.
Sau hơn 3 thập kỷ nỗ lực hoàn thành mục tiêu phổ cập dịch vụ viễn thông, đưa viễn thông và công nghệ thông tin vào mọi lĩnh vực của cuộc sống ở Việt Nam, Tập đoàn Công nghiệp - Viễn thông Quân đội (Viettel) đặt ra khát vọng trở thành Tập đoàn công nghiệp và công nghệ vươn tầm thế giới. Ở bất cứ giai đoạn nào trên hành trình ấy, lời hứa “sáng tạo vì con người” vẫn còn mãi.
 CÁC NỘI DUNG CHƯƠNG TRÌNH
1. Mục đích:
Triển khai các hoạt động định hướng nghề nghiệp từ sớm cho sinh viên
Cung cấp cho sinh viên các thông tin về môi trường làm việc thực tế tại doanh nghiệp sản xuất
Tuyển dụng các sinh viên có nhu cầu tìm kiếm việc làm.
2. Đối tượng tham gia:
Là sinh viên của ĐH Bách Khoa Hà Nội
Đang theo học các chuyên ngành kỹ thuật
Ưu tiên sinh viên năm 2 đến năm cuối, có mong muốn tìm hiểu thêm về cơ hội việc làm tại Viettel.
+ Địa điểm đón sinh viên: Thư viện Tạ Quang Bửu
    + Địa điểm tham quan:
Học viện Viettel: Thôn 6, Xã Thạch Hoà, Huyện Thạch Thất, Hà Nội
Trung tâm Vận hành Khai thác toàn cầu: Tòa nhà Viettel, Khu Công nghệ cao Hòa Lạc, Thạch Thất, Hà Nội
3. Số lượng tham gia: tối đa 120 sinh viên /đợt tham quan
Lưu ý:
Sinh viên tập trung đúng giờ, tuân thủ điều phối của Ban tổ chức
Lưu ý về trang phục và phát ngôn trong quá trình đi tham quan (Trang phục lịch sự, ưu tiên đồng phục trường, mang giầy hoặc dép quai hậu)","1, Tham gia hội thảo tăng cường kỹ năng mềm, phương pháp học tập, ý thức học tập, làm việc
2, Tham gia hoạt động hướng nghiệp, tìm kiếm thông tin việc làm",Sảnh Thư viện Tạ Quang Bửu,12:00 24/04/2024 đến 16:30 24/04/2024,"Tổ hỗ trợ thực tập, việc làm doanh nghiệp",16:30 24/04/2024
CHƯƠNG TRÌNH NGÀY SÁCH VÀ VĂN HÓA ĐỌC VIỆT NAM 2024,"Sách có tầm quan trọng và ý nghĩa lớn lao trong đời sống tinh thần của mỗi người. Hằng năm chúng ta có Sự kiện Sách và văn hóa đọc Việt Nam 21/4 và Sự kiện Sách và Bản quyền thế giới 23/4, trong đó, sự kiện Sách và Văn hóa đọc Việt Nam được ĐH Bách khoa Hà Nội tổ chức thường niên nhằm phát triển Văn hóa đọc sâu rộng trong sinh viên.
Năm nay, sự kiện được Trung tâm Truyền thông và Tri thức số phối hợp với các đơn vị trong Đại học tổ chức với chủ đề: ĐỌC SÁCH HAY, SÁNG TƯƠNG LAI”. Đây là chủ đề phù hợp với tuổi trẻ, với sinh viên, thúc đẩy các em đọc sách để học tập suốt đời, hướng tới tương lai bản lĩnh, trí thức, tự tin và thành công.
Sự kiện sẽ diễn ra với rất nhiều nội dung hấp dẫn: Trưng bày các mô hình sách nghệ thuật, giao lưu Bí quyết chọn sách hiệu quả và đặc biệt là phần chia sẻ “Đọc sách để làm giàu” đến từ khách mời của sự kiện. Cùng với đó các bạn sẽ được tham gia các trò chơi có thưởng và được chấm điểm rèn luyện sau khi trả lời các câu hỏi của Ban tổ chức.
Thời gian diễn ra sự kiện: Trong 2 ngày 16-17/04/2024
- Phần Khai mạc: Từ 8h00 đến 11h15 ngày 16/04/2024
- Triển lãm các mô hình nghệ thuật, tặng sách, triểm lãm sách: Từ 8h00 đến 16h30 ngày 16-17/04/2024
Địa điểm: Sảnh tầng 1 – Tòa nhà Thư viện Tạ Quang Bửu – Đại học Bách khoa Hà Nội.
------------
Minh chứng tham gia hoạt động: Chụp ảnh chân dung (yêu cầu rõ mặt) và checkin trong thời gian quy định (8h00 - 11h ngày 16/4/2024).
Cụ thể:
+ Sinh viên bắt buộc check in 2 lần bằng app iCTSV: lần 1 trong khoảng thời gian 8h00 - 9h00; lần 2 từ 10h00 đến 11h và làm bài test trong khung thời gian công bố tại chương trình.
+ Checkin có mặt với Backdrop tại chương trình.
Lưu ý: Do sức chứa tại Sảnh tầng 1 Thư Viện có hạn nên chương trình ưu tiên các bạn sinh viên đến sớm và đúng giờ.
-----------------------------------
THÔNG TIN LIÊN HỆ
Trung tâm Truyền thông và Tri thức số
(84-24) 3869 2243,
Email: tvtqb@hust.edu.vn, thanh.buithi@hust.edu.vn, linh.daothi@hust.edu.vn
Fanpage: https://www.facebook.com/TQB.library","1, Tham gia hội thảo tăng cường kỹ năng mềm, phương pháp học tập, ý thức học tập, làm việc
2, Tham gia các hoạt động phổ biến, tìm hiểu bản sắc văn hóa dân tộc, văn hóa địa phương, văn hóa trường học,…",Sảnh Tầng 1 TV Tạ Quang Bửu,08:00 16/04/2024 đến 11:00 16/04/2024,"Tổ hỗ trợ, tư vấn học tập và tâm lý",11:00 16/04/2024
[Chuỗi hoạt động Jobfair 2024] CÔNG TY TNHH QUỐC TẾ UNILEVER VIỆT NAM,"🔔 UTALK – NẮM BẮT CƠ HỘI LÀM VIỆC TẠI TOP 5 NHÀ MÁY KĨ THUẬT SỐ CỦA UNILEVER 🔔
💥 CƠ HỘI VIỆC LÀM ĐỘC QUYỀN DÀNH CHO SINH VIÊN BÁCH KHOA TẠI CHƯƠNG TRÌNH UTALK 💥
👉 Thời gian: Chủ Nhật, 14/04/2024 | 13:30 – 16:00
👉 Địa điểm: Hội thảo C2 | Đại học Bách khoa Hà Nội
👉 Dành riêng cho sinh viên Bách khoa Hà Nội: Cơ hội tham gia chương trình tham quan trải nghiệm & thực tập tại nhà máy Unilever Bắc Ninh
_________________
Tự hào là một trong những tập đoàn FMCG (hàng tiêu dùng nhanh) lớn nhất tại Việt Nam, Unilever luôn tự hào với hành trình 30 năm đồng hành và kiến tạo những giá trị tốt đẹp cùng người Việt. Xuyên suốt chặng đường đó, Unilever Việt Nam vẫn luôn nỗ lực để cải thiện chất lượng cuộc sống của người tiêu dùng thông qua những sản phẩm chất lượng với giá thành hợp lý tới từ những nhãn hàng quen thuộc như Omo, Sunlight, P/S, Knorr, Vim,...
Để làm được điều đó, Unilever Việt Nam dành rất nhiều sự đầu tư về tài chính và nhân lực để xây dựng một mô hình sản xuất hiệu quả với công nghệ thông minh và hiện đại. Nhờ đó mà nhà máy của Unilever tại Việt Nam được ghi nhận nằm trong top 5 nhà máy có trình độ số hóa và tự động hóa cao nhất trên toàn cầu. Chính vì vậy, làm việc tại nhà máy của Unilever Việt Nam cũng đồng nghĩa với việc được học hỏi và phát triển trong môi trường hiện đại, tân tiến và chuyên nghiệp
Tháng 4 này, hòa chung không khí ngày hội việc làm tại Đại học Bách khoa Hà Nội, Unilever Việt Nam tổ chức buổi chia sẻ về nghề nghiệp Utalk dành riêng cho các tài năng trẻ của trường. Đến với Utalk lần này, các bạn sẽ có cơ hội được:
• Tìm hiểu tổng quan về Unilever Việt Nam – nơi làm việc tốt nhất tại Việt Nam và châu Á trong 10 năm liên tiếp
• Tiếp xúc với nhà máy số hóa và tự động hóa hiện đại của Unilever
• Làm quen với những cơ hội phát triển nghề nghiệp dành cho sinh viên kỹ thuật tại Unilever Việt Nam
• Trò chuyện với ban Lãnh Đạo của nhà máy Unilever
• Nắm bắt cơ hội tham quan, trải nghiệm và thực tập tại nhà máy của Unilever tại Bắc Ninh
• Nhận những quà tặng sản phẩm tới từ Unilever Việt Nam
Còn chần chờ gì nữa mà không đăng ký tham gia chương trình để nắm lấy những thông tin và cơ hội độc quyền của sinh viên Bách khoa Hà Nội!
Hẹn gặp bạn tại Utalk – Nắm bắt cơ hội làm việc tại top 5 nhà máy kỹ thuật số của Unilever vào ngày 14/04 sắp tới nhé!
Minh chứng tham gia hoạt động:
Chụp minh chứng tham dự trong sự kiện (có kèm ảnh chân dung với slide cuối cùng) và checkin trực tiếp tại sự kiện.
Lưu ý: các bạn sinh viên chỉ chụp minh chứng ở standee bên ngoài sẽ không được phê duyệt.","1, Tham gia hội thảo tăng cường kỹ năng mềm, phương pháp học tập, ý thức học tập, làm việc
2, Tham gia hoạt động hướng nghiệp, tìm kiếm thông tin việc làm","Phòng Hội thảo C2, ĐHBK Hà Nội",13:00 14/04/2024 đến 16:00 14/04/2024,"Tổ hỗ trợ thực tập, việc làm doanh nghiệp",16:00 14/04/2024
[Chuỗi hoạt động Jobfair 2024] CÔNG TY TNHH LIXIL VIỆT NAM,"[𝐋𝐈𝐗𝐈𝐋 𝐕𝐍 - 𝐓𝐚𝐥𝐤𝐬𝐡𝐨𝐰 𝐒𝐞𝐫𝐢𝐞𝐬: 𝐒𝐇𝐀𝐏𝐄 𝐘𝐎𝐔𝐑 𝐂𝐀𝐑𝐄𝐄𝐑]
𝐂𝐀𝐑𝐄𝐄𝐑 𝐓𝐀𝐋𝐊 #𝟏 - 𝐒𝐇𝐀𝐑𝐏𝐄𝐍 𝐘𝐎𝐔𝐑 𝐂𝐕
  ⏰ Thời gian: Sáng 08h30, Chủ Nhật ngày 14/04/2024
💻 Địa điểm: Phòng Hội thảo C2, ĐH Bách khoa Hà Nội
  Một chương trình siêu xịn và đăng ký HOÀN TOÀN MIỄN PHÍ trước 10/04/2024!!
Lưu ý: Số lượng đăng ký có hạn!!
Là sinh viên những năm cuối, hẳn bạn đang lo lắng chuẩn bị cho chiếc CV xin việc đầu tiên.
Loay hoay chưa biết bắt đầu từ đâu?
Băn khoăn không rõ làm cách nào để gây ấn tượng tích cực cho nhà tuyển dụng?
Đừng lo lắng, vì đã có LIXIL Việt Nam sẵn sàng đồng hành cùng bạn trên hành trang khởi tạo chiếc CV chuyên nghiệp đầu tiên trong đời!
Career Talk #1 với chủ đề Hướng dẫn kỹ năng viết CV - Sharpen Your CV cùng với các Diễn giả & Chuyên viên tuyển dụng của LIXIL sẽ là cơ hội tuyệt vời giúp các bạn sinh viên nhận ra những lỗi sai cần tránh & cách khởi tạo 1 chiếc CV đầu tay như ý, chuyên nghiệp.
Còn chần chừ gì nữa! Nhanh tay gửi đăng ký và chia sẻ thông tin hữu ích này ngay tới bạn bè mình thôi:
Link đăng ký: https://forms.office.com/r/rjn7hjuy21
Thời gian: Chủ Nhật ngày 14/04/2024.
Địa điểm: Hội thảo C2, Đại học Bách khoa Hà Nội (Số 1 Đại Cồ Việt, Bách Khoa, Hai Bà Trưng, Hà Nội).
--------------------
*Bài viết thuộc chuỗi hoạt động Ngày hội việc làm, hướng nghiệp và tư vấn tuyển sinh – Shape Your Career 2024 của LIXIL Việt Nam.
  [Vị trí tuyển dụng]
Minh chứng tham gia hoạt động:
Chụp minh chứng tham dự trong sự kiện (có kèm ảnh chân dung với slide cuối cùng) và checkin trực tiếp tại sự kiện.
Lưu ý: các bạn sinh viên chỉ chụp minh chứng ở standee bên ngoài sẽ không được phê duyệt.","1, Tham gia hội thảo tăng cường kỹ năng mềm, phương pháp học tập, ý thức học tập, làm việc
2, Tham gia hoạt động hướng nghiệp, tìm kiếm thông tin việc làm","Phòng Hội thảo C2, ĐHBK Hà Nội",08:30 14/04/2024 đến 11:00 14/04/2024,"Tổ hỗ trợ thực tập, việc làm doanh nghiệp",11:00 14/04/2024
