title,page_content,criteria,Địa điểm:,Thời gian:,BTC:,Hạn nộp MC:
HỘI THẢO TUYỂN DỤNG CỦA CÔNG TY TNHH LG ELECTRONICS VIỆT NAM HẢI PHÒNG,"Địa chỉ: Lô CN2, KCN Tràng Duệ, xã Lê Lợi, An Dương, Hải Phòng
“Hãy để LGEVH đồng hành cùng ước mơ của bạn!”
Chính thức có mặt tại Việt Nam năm 1995, với sự nỗ lực không ngừng, LGEVH đã và đang tiếp tục khẳng định vị thế của một công ty hàng đầu thế giới, trở thành thương hiệu quen thuộc với người tiêu dùng. Các sản phẩm như tủ lạnh, máy hút bụi, máy giặt, và thiết bị nghe nhìn trong ô tô được đưa vào sản xuất thương mại và xuất khẩu đi khắp thế giới. Song song cùng hoạt động kinh doanh, với quan niệm con người là tài sản quý giá nhất, LGEVH không ngừng xây dựng và đổi mới các hoạt động văn hóa, đào tạo nhằm đem đến môi trường làm việc chuyên nghiệp, thông minh và hạnh phúc nhất cho người lao động. LGEVH xứng đáng trở thành ngôi nhà thứ 2 nơi bạn có thể gắn bó và phát triển sự nghiệp lâu dài.
- Thời gian: 8h30 ngày 14 tháng 11 năm 2024 (Thứ Năm)
- Địa điểm: Phòng Hội thảo C2
- Đối tượng tham dự: Sinh viên năm cuối, sinh viên đã tốt nghiệp có nguyện vọng làm việc tại LG Electronic Việt Nam Hải Phòng
Sinh viên thuộc các Trường Điện - Điện tử; Cơ khí; Hóa và khoa học sự sống; Kinh tế.
Phúc lợi:
Mức lương, phụ cấp, thu nhập cạnh tranh lên đến 15 ~ 20 triệu/ tháng
Trợ cấp thu hút cho DH Bách Khoa, trợ cấp công việc,…
Tăng lương hàng năm, tăng lương khi lên bậc
Lương tháng 13,14, thưởng KPI, các giải thưởng cho tập thể & cá nhân
Lộ trình thăng tiến rõ ràng, song song cả cấp bậc và chức vụ, nhiều cơ hội thăng tiến cho cán bộ trẻ với nhu cầu mở rộng sản xuất cao
5 ngày làm việc/ tuần, nghỉ thứ 7, chủ nhật
Du lịch thả ga với các kỳ nghỉ dài (nghỉ hè, nghỉ đông)
Môi trường làm việc chuyên nghiệp, với các quy trình, hệ thống, máy móc, trang thiết bị hiện đại, chuẩn hóa từ Hàn Quốc được áp dụng toàn cầu
Nhiều hoạt động văn hóa, thể thao, teambuilding diễn ra liên tục trong năm
Hệ thống đào tạo đa dạng, đầy đủ: đào tạo người mới, các kỹ năng cơ bản, tiếng Anh, tiếng Hàn, kỹ năng mềm, các kiến thức, kỹ năng chuyên môn, đào tạo trong công việc, đào tạo tại nước ngoài…
Cung cấp đầy đủ các điều kiện, trang thiết bị phục vụ công việc: Laptop LG Gram, bữa ăn tại công ty, xe bus đưa đón Hải Phòng, Hà Nội, bảo hiểm tai nạn 24h,…
Cơ sở vật chất hiện đại: văn phòng, nhà ăn, phòng y tế, canteen, ATM, café, khu vực thể thao, sân bóng, khu vực ăn BBQ, Learning Center, khu vực nghỉ cho bà bầu,…
Vị trí tuyển dụng
Thực tập sinh kỹ thuật tại các phòng ban của công ty:
Hỗ trợ lương: 6 tr/ tháng + tăng ca theo thực tế
Cung cấp laptop, các thiết bị cần thiết cho công việc
Bữa ăn miễn phí tại công ty
Được đào tạo, thực hành công việc thực tế, tham gia các hoạt động văn hóa, thể thao, liên hoan chung của phòng ban
Trở thành nhân viên chính thức sau khi tốt nghiệp
Nhân viên Nghiên cứu & Phát triển (R&D): Sản phẩm tủ lạnh, máy hút bụi, máy giặt, và thiết bị nghe nhìn trong ô tô (IVI)
Phát triển sản phẩm mới và đưa vào sản xuất
Tiến hành các hoạt động cải tiến hiệu suất và chi phí
Hỗ trợ giải quyết các vấn đề tại chuyền
Nhân viên Phát triển mạch điều khiển điện tử (Controller)
Theo dõi tình trạng phát triển, thiết lập chương trình vận hành cho sản phẩm
Nghiên cứu BOM, vẽ 2D cho bộ phận mới của sản phẩm
Phân tích và giải quyết vấn đề liên quan đến điện tử trên chuyền
Đưa ra ý tưởng cải tiến về chi phí
Nhân viên Quản lý sản xuất (MFG)
Kiểm soát, giám sát số lượng sản xuất.
Kiểm soát năng lực sản xuất và kiểm soát nhân lực
Hoàn thành kế hoạch sản xuất hàng ngày
Nhân viên Quản lý chất lượng (QA)
Giữ ổn định và nâng cao chất lượng sản xuất.
Phát triển, kiểm soát các hoạt động về chất lượng
Quản lý chất lượng đầu vào, đầu ra, trên chuyền
Nhân viên Kỹ thuật sản xuất (PE)
Quản lý tình trạng máy móc thiết bị.
Cải tiến nâng cao năng suất của máy móc.
Nghiên cứu, chế tạo và lắp đặt hệ thống tự động hóa
Một số vị trí khác: IT/Security, Nhân viên tiếng Hàn & tiếng Anh, Mua hàng, Vật tư, Quản lý chuỗi cung ứng, Kế hoạch sản xuất...
Yêu cầu tuyển dụng
Tốt nghiệp Đại học chuyên ngành Kỹ thuật hoặc liên quan: Cơ khí/ Cơ điện tử/ Tự động hóa/Nhiệt lạnh/ Điện – điện tử/ Điện tử viễn thông...
Tiếng Anh giao tiếp tốt, tương đương Toeic 450+
Chăm chỉ, có trách nhiệm với công việc, chủ động, có tinh thần học hỏi cao
Mong muốn làm việc tại Hải Phòng và gắn bó lâu dài với công ty
Minh chứng tham gia hoạt động:
Chụp minh chứng slide cuối cùng của doanh nghiệp (có kèm ảnh chân dung) và checkin trực tiếp tại sự kiện.
Lưu ý: các bạn sinh viên chỉ chụp minh chứng ở standee bên ngoài Hội thảo sẽ không được phê duyệt.","1, Tham gia hội thảo tăng cường kỹ năng mềm, phương pháp học tập, ý thức học tập, làm việc
2, Tham gia hoạt động hướng nghiệp, tìm kiếm thông tin việc làm",Phòng Hội thảo C2,08:30 14/11/2024 đến 11:30 14/11/2024,"Tổ hỗ trợ thực tập, việc làm doanh nghiệp",11:30 14/11/2024
Lễ khai mạc Hội thao Công đoàn Đại học Bách khoa Hà Nội,"Nằm trong chuỗi hoạt động kỷ niệm 42 năm ngày Nhà giáo Việt Nam 20/11 (20/11/1982 - 20/11/2024) và chào mừng kỷ niệm 35 năm ngày hội Quốc phòng toàn dân (22/12/1989-22/12/2024), sáng ngày 5/11/2024, sẽ diễn ra Lễ khai mạc Hội thao Công đoàn Đại học Bách khoa Hà Nội (ĐHBKHN) năm 2024 tại Nhà thi đấu Bách Khoa.
Hội thao Công đoàn là hoạt động không thể thiếu vào mỗi mùa Hiến chương Nhà giáo, là cơ hội để các đơn vị thể hiện sức mạnh, sự đoàn kết tập thể, sự giao lưu, chia sẻ, giữa các đoàn viên công đoàn, giữa các đơn vị tham gia thi đấu đồng thời nâng cao tinh thần rèn luyện thể chất, góp phần phát triển phong trào thể dục thể thao. Đây là hoạt động khẳng định ĐHBKHN nỗ lực mang đến cho cán bộ, giảng viên, người lao động của trường  cơ hội rèn luyện và giải trí bổ ích để cải thiện sức khỏe và gia tăng sự hào hứng, nâng cao hiệu quả trong công việc. 
Để góp phần động viên, khuyến khích phong trào tập luyện thể dục thể thao, rèn luyện sức khoẻ cho thầy cô và cán bộ viên chức, tạo động lực thúc đẩy phong trào thi đua dạy tốt, học tốt, tạo sự gắn kết giữa thầy cô với sinh viên, Ban tổ chức mong muốn các sinh viên tham gia Lễ khai mạc và cổ vũ các cuộc thi của các thầy cô theo kế hoạch sau:
Thời gian: 7h15, thứ Ba, ngày 05/11/2024
Địa điểm: Nhà thi đấu Bách khoa
Minh chứng: Chụp ảnh và checkin sự kiện hai lần trong đó: lần 1 lúc 7h00 thứ Ba, ngày 05/11/2024, lần 2 lúc 8h15 thứ Ba, ngày 05/11/2024.","1, Tham gia giữ gìn an ninh – trật tự, bảo vệ sinh cảnh quan - môi trường, nếp sống văn minh nơi công cộng, quảng bá hình ảnh đẹp của Nhà trường được địa phương, Nhà trường công nhận
2, Tham gia các hoạt động phổ biến, tìm hiểu bản sắc văn hóa dân tộc, văn hóa địa phương, văn hóa trường học,…
3, Tham gia cổ vũ các hoạt động phong trào văn hóa, thể thao",Nhà thi đấu Bách khoa,07:00 05/11/2024 đến 10:00 05/11/2024,Đại học Bách Khoa Hà Nội,10:00 05/11/2024
SEKISHO JOB FAIR 2024,"📣📣📣Sự kiện Job Fair sắp tới sẽ có rất nhiều doanh nghiệp tham gia, hoạt động trong các lĩnh vực sản xuất, IT, Xây dựng, thương mại bán lẻ.
Đối tượng sinh viên tất cả các ngành và các khóa toàn trường.
Địa điểm: Hội trường C2, ĐH Bách khoa Hà Nội
Thời gian: Chương trình diễn ra trong 2 ngày từ ngày 2/11-3/11/2024 | 8h sáng -> 17h00 chiều (Các bạn có thể đến các khung giờ và vào bàn check in).
Mặc dù đây là ngày hội việc làm của doanh nghiệp Nhật, tuy nhiên sự kiện sẽ bố trí phiên dịch xuyên suốt trong các buổi giới thiệu thông tin doanh nghiệp cũng như phỏng vấn. Vì vậy, bạn không cần lo lắng về năng lực ngoại ngữ hiện tại của mình nhé.
Đây là cơ hội quý dành cho tất cả sinh viên có cơ hội trúng tuyển thành nhân viên chính thức tại doanh nghiệp Nhật Bản ngay từ khi còn trên ghế nhà trường.
Bạn nhớ đừng bỏ qua cơ hội lần này nhé!
Để có thể tham gia Sekisho Job Fair, bạn hãy đăng ký tài khoản trước trên trang web.
Các bạn có thể xem thông tin các doanh nghiệp tham gia Job Fair sau khi đăng kí tài khoản và đăng nhập lại trên trang web sự kiện.
Đăng ký tại đây:
https://event.sekisho-vn.com/entry/SCP/HANOI_SJF_2024/
---------------------------------
Minh chứng tham gia hoạt động:
Chụp minh chứng tham dự trong Hội trường (có kèm ảnh chân dung) và checkin trực tiếp tại sự kiện. Tham khảo minh chứng mẫu: (đang cập nhật)
Lưu ý: các bạn sinh viên chỉ chụp minh chứng ở standee bên ngoài Hội trường sẽ không được phê duyệt.","1, Tham gia hội thảo tăng cường kỹ năng mềm, phương pháp học tập, ý thức học tập, làm việc
2, Tham gia hoạt động hướng nghiệp, tìm kiếm thông tin việc làm",Hội trường C2 - Đại học Bách khoa Hà Nội,07:00 02/11/2024 đến 17:00 03/11/2024,Ban CTSV,17:00 03/11/2024
🛡️ FPT Leader Talk: WIN “U” GAME 4 - BIẾN TIỀM NĂNG THÀNH TÀI NĂNG,"🌟Chương trình đầu tiên trong chuỗi Talkshow Win U Game 4 - talkshow chia sẻ về kỹ năng học tập và hoạt động ở đại học dành cho sinh viên - sẽ được tổ chức trực tiếp tại ĐH Bách khoa Hà Nội.
🎓 Sinh viên Bách Khoa vốn nổi tiếng là những bạn trẻ xuất sắc với nhiều thành tích, giải thưởng trong các cuộc thi. Tuy nhiên bước vào giảng đường đại học, không ít bạn gặp những khó khăn và thách thức trong việc làm chủ hành trình chinh phục tri thức của mình. Trượt môn, học lại, cảnh cáo học tập… cùng áp lực từ việc cân bằng giữa học tập và phát triển cá nhân là những “chông gai” mà nhiều sinh viên phải đối mặt.
🤔Làm sao để có thể biến tiềm năng thành tài năng?
🤔Làm sao để bạn không chỉ tồn tại mà còn bứt phá và tỏa sáng trong môi trường đại học?
💎 FPT Leader Talk: WIN ""U"" GAME 4 - BIẾN TIỀM NĂNG THÀNH TÀI NĂNG chính là sự kiện giúp bạn tìm ra câu trả lời. Lấy cảm hứng từ cuốn sách Hidden Potential của Adam Grant, sự kiện sẽ giúp bạn không chỉ nhìn ra những năng lực tiềm ẩn bên trong mình mà còn cung cấp phương pháp để khai phá và biến nó thành tài năng thực sự. 
💎Hãy tham gia ngay để trang bị cho mình những bí kíp thành công, làm chủ đại học và vươn tới những đỉnh cao mới!
✨DÀN DIỄN GIẢ SẼ ĐỒNG HÀNH CÙNG BẠN LÀ AI? 
➤ Anh Hoàng Nam Tiến - Thành viên Hội đồng sáng lập Tập đoàn FPT, Chủ tịch Hội Cựu sinh viên ĐH Bách Khoa Hà Nội tại FPT.
➤ Nguyễn Thế An - Thủ khoa đầu ra ĐHBKHN với điểm số tốt nghiệp tuyệt đối (CPA: 4.0/4.0), hiện đang là AI Resident tại FPT Software AI Center.
➤ Host Đào Việt Bách - Founder kênh hướng nghiệp BackStory, Thủ lĩnh sinh viên toàn quốc lần thứ I.
✨NHỮNG LÝ DO BẠN KHÔNG NÊN BỎ LỠ TALKSHOW:
✅ Gặp gỡ & giao lưu cùng những diễn giả, cựu sinh viên xuất sắc của Đại học Bách khoa Hà Nội
✅ Nắm bắt bí quyết phát triển toàn diện, cách khai phá tiềm năng của bản thân thành tài năng để tỏa sáng trên hành trình Đại học.
✅ Cơ hội rinh về những phần quà hấp dẫn: Tham gia và có cơ hội nhận được các học bổng và nhiều phần quà vô cùng giá trị.
➖➖➖➖➖➖➖➖➖
WIN “U” GAME - BIẾN TIỀM NĂNG THÀNH TÀI NĂNG:
▪️ Thời gian: 8h30, thứ 4 ngày 30/10/2024
▪️ Địa điểm: Hội trường C2 - Đại học Bách khoa Hà Nội.
Minh chứng tham gia hoạt động:
Chụp minh chứng slide cuối cùng của doanh nghiệp (có kèm ảnh chân dung) và checkin trực tiếp tại sự kiện.
Lưu ý: các bạn sinh viên chỉ chụp minh chứng ở standee bên ngoài Hội thảo sẽ không được phê duyệt.","1, Tham gia hội thảo tăng cường kỹ năng mềm, phương pháp học tập, ý thức học tập, làm việc
2, Tham gia Sinh hoạt công dân do nhà trường tổ chức",Hội trường C2,08:30 30/10/2024 đến 12:30 30/10/2024,Ban CTSV,12:30 30/10/2024
Hội thảo tuyển dụng của Công ty TNHH LG Innotek Việt Nam Hải Phòng dành cho sinh viên năm cuối,"GIỚI THIỆU VỀ CÔNG TY:
Công ty TNHH LG Innotek Việt Nam Hải Phòng có địa chỉ tại khu công nghiệp Tràng Duệ, huyện An Dương, thành phố Hải Phòng, Việt Nam, là Công ty số 1 toàn cầu trong 12 năm liên tiếp về sản xuất Camera Module cho các khách hàng hàng đầu thế giới trong đó có Apple.
Nhà máy LG Innotek tại Hải Phòng với vốn đầu tư là hơn 2,05 tỷ USD, đã  đi vào sản xuất từ cuối năm 2017. Trong giai đoạn 2024 ~ 2030, chúng tôi tiếp tục mở rộng sản xuất, đã xây dựng nhà máy V2 và đang trong quá trình xây dựng nhà máy V3. Trong tương lai, LG Innotek sẽ là một trong những nhà máy có số vốn đầu tư nước ngoài lớn nhất tại Hải Phòng và khu vực lân cận
CÁC VỊ TRÍ TUYỂN DỤNG KỸ SƯ / THỰC TẬP SINH KỸ THUẬT:
Làm việc / Thực tập tại các phòng ban của Công ty LG Innotek Việt Nam Hải Phòng.
Phòng Kĩ thuật sản xuất:
Là người trực tiếp làm việc với máy móc, cải thiện hiệu suất và quy trình sản xuất. Bảo trì và khắc phục sự cố, lập trình M/C, công việc khác sẽ được đào tạo khi vào làm tại công ty tùy theo tính chất của từng vị trí, công đoạn.
Phòng Phát triển sản phẩm mới:
Tiếp nhận công nghệ mới nhất để đưa sản phẩm mẫu vào triển khai, sản xuất hàng loạt. Nghiên cứu, cải tiến, phát triển tính năng của sản phẩm trong tương lai và nhiều công việc khác.
Phòng Quản lý sản xuất:
Quản lý KPI, năng suất sản xuất, kiểm soát quá trình sản xuất sản phẩm đạt được mục tiêu đề ra, và nhiều các công việc khác liên quan.
Phòng Quản lý chất lượng:
Quản lý chất lượng nguyên vật liệu, sản phẩm đầu ra và kiểm soát lỗi trong quá trình sản xuất, báo cáo đối ứng khách hàng, sử dụng công cụ chất lượng để đo lường (six sigma, 7 QC tools,..).
Thời gian bắt đầu làm việc / thực tập: Theo lịch của ứng viên / sinh viên
Yêu cầu đối với kỹ sư / thực tập sinh:
Đã tốt nghiệp hoặc đang là sinh viên năm cuối các chuyên ngành Điện - điện tử, Cơ khí, Cơ điện tử, Tự động hóa, Điện tử viễn thông, Công nghệ thông tin, Vật lý kỹ thuật, Vật liệu, Kỹ thuật hóa học và chuyên ngành kỹ thuật khác…
Kiên trì, chăm chỉ, trung thực, tự tin
Thành thạo tin học văn phòng
Có khả năng giao tiếp bằng Tiếng Anh ( tương đương TOEIC 500+)
QUYỀN LỢI LÀM VIỆC/THỰC TẬP TẠI CÔNG TY:
- Top 100 Nơi làm việc tốt nhất Việt Nam 2022 & 2023, Top 7 trong lĩnh vực Điện tử - Công nghệ cao, Top 15 Doanh nghiệp có nguồn nhân lực hạnh phúc nhất tại Việt Nam
- Mức lương, trợ cấp hàng tháng hấp dẫn, có trợ cấp riêng dành cho sinh viên tốt nghiệp từ Đại học Bách Khoa Hà Nội
- Thời gian làm việc: Toàn thời gian từ thứ 2 đến thứ 6, nghỉ tất cả Thứ 7 – Chủ nhật
- Được cung cấp miễn phí laptop LG Gram trị giá 1500$ khi làm việc
- Xe bus đưa đón miễn phí tại Hải Phòng, Hải Dương, Thái Bình, Hà Nội (vào cuối tuần)
- Các bữa ăn miễn phí hàng ngày, thực đơn đặc biệt hàng tháng
- Cung cấp ký túc xá (miễn phí) cho nhân viên ở xa
- Chăm sóc sức khỏe toàn diện, chế độ bảo hiểm 24/7
- Tham gia các hoạt động Team building, đào tạo ngoại ngữ, đào tạo kỹ năng mềm, đào tạo tại nước ngoài… theo chương trình P.R.I.D.E
Và rất nhiều quyền lợi hấp dẫn khác
Minh chứng tham gia hoạt động:
Chụp minh chứng slide cuối cùng của doanh nghiệp (có kèm ảnh chân dung) và checkin trực tiếp tại sự kiện.
Lưu ý: các bạn sinh viên chỉ chụp minh chứng ở standee bên ngoài Hội thảo sẽ không được phê duyệt.","1, Tham gia hội thảo tăng cường kỹ năng mềm, phương pháp học tập, ý thức học tập, làm việc
2, Tham gia hoạt động hướng nghiệp, tìm kiếm thông tin việc làm",Phòng Hội thảo C2,08:30 29/10/2024 đến 11:30 29/10/2024,"Tổ hỗ trợ thực tập, việc làm doanh nghiệp",11:30 29/10/2024
"Chương trình Helmet 4 Life - Đội mũ bảo hiểm, bảo vệ cuộc sống","Năm 2023, TotalEnergies đã khởi động sáng kiến “Helmet 4 Life”/ “Đội mũ bảo hiểm, bảo vệ cuộc sống” tại 40 quốc gia trên ba lục địa (Châu Phi, Châu Á và Châu Mỹ). Thông qua TotalEnergies Foundation và các công ty thành viên, chương trình tặng 100.000 mũ bảo hiểm xe máy, tuân thủ các tiêu chuẩn an toàn nghiêm ngặt. Tại Việt Nam, công ty rất vui mừng tiếp tục năm thứ hai chương trình “Helmet 4 Life” và đã triển khai tại 32 trường phổ thông và đại học tại Việt Nam với thông điệp.
An toàn là giá trị cốt lõi của TotalEnergies.
Chiến dịch tặng mũ bảo hiểm sẽ đi kèm với các buổi nâng cao nhận thức về an toàn.
Với mong muốn tạo điều kiện cho sinh viên BKHN có cơ hội tiếp cận với chương trình, Lãnh đạo Đại học Bách Khoa Hà Nội đã phối hợp với đại diện TotalEnergies tổ chức chương trình “Helmet 4 Life”/ “Đội mũ bảo hiểm, bảo vệ cuộc sống” theo kế hoạch sau:
Thời gian: 14h00 - 16h30 ngày 28 tháng 10 năm 2024.
Địa điểm: Hội trường C2.
Nội dung: tham gia chương trình các bạn sẽ được chia sẻ các nội dung để:
Tích cực nâng cao nhận thức của người lái xe về các tình huống rủi ro, bảo dưỡng phương tiện và tuân thủ các quy định giao thông, và sự cần thiết của việc trang bị thiết bị bảo hộ;
Cơ hội nhận mũ mũ bảo hiểm chất lượng cho người điều khiển xe mô tô hai bánh, góp phần ngăn ngừa tử vong và/hoặc thương tích nghiêm trọng trong các vụ tai nạn giao thông.
Cơ hội giao lưu, lắng nghe các chia sẻ hữu ích từ các anh chị cựu sinh viên ngành Kỹ thuật Hóa học, Điện, Điện tử, Cơ khí và Nhiệt lạnh và Kinh tế.
Ưu tiên: sinh viên ngành Kỹ thuật Hóa học, Điện, Điện tử, Cơ khí, Nhiệt lạnh và Kinh tế.
Lưu ý các bạn sẽ có cơ hội nhận quà tặng từ chương trình nếu:
Tham gia đầy đủ chương trình, và
Có kết quả bài thu hoạch trả lời đúng hơn 75% câu hỏi, và 
Có thứ hạng cao, BTC sẽ ưu tiên phát quà theo thứ hạng từ cao xuống tới thấp tới khi hết quà, và
Cam kết không bán quà dưới mọi hình thức khi được tặng.
Minh chứng: chụp ảnh checkin tối thiểu 02 lần tại hội trường C2 trong thời gian diễn ra chương trình.","1, Tham gia hội thảo tăng cường kỹ năng mềm, phương pháp học tập, ý thức học tập, làm việc
2, Tham gia Sinh hoạt công dân do nhà trường tổ chức",Hội trường C2,13:45 28/10/2024 đến 16:30 28/10/2024,Ban CTSV,16:30 28/10/2024
